Address,Email Address,License Validity,Name,Official Representative,Status,Tel No/s,Website
"U201&202 (2F) & UNIT 705 (7F) FSS BLG II 18 SCT TU LAGING HANDA, QUEZON CITY",info@quantumgroup-ph.com,11/6/2015 to 11/6/2019,QRD INTERNATIONAL PLACEMENT INC Private Employment Agency,GERARD B SANVICTORES,Valid License,(02) 375-1144/ 709-7772 / 09088946124,qrdinternational.com
"2F, INOCENCIO BLDG, 98 SEN GIL PUYAT AVENUE PASAY CITY",admin@quaestus-ips.com,2/23/2017 to 2/22/2021,QUAESTUS INTERNATIONAL PLACEMENT SERVICES Private Employment Agency,MARIO U RABANG,Valid License,711-2936 / 398-1102 / 0917-8480036 (mobile),www.quaestus-ips.com
STE 304 & 305 VILLA DEVT BLDG 78-80 JUPITER MKTI ,,4/20/1994 to 4/18/1996,QUALITY LABOR LINK CORPORATION  Service Contractor,ANNABELLE G CARDONA,Delisted,861848,
"3RD FLOOR ASTORIA BLDG 1170 C A MABINI STREET ERMITA, MANILA",quantumworkabroad@gmail.com,8/24/2016 to 8/24/2018,QUANTUM WORK ABROAD SERVICES INC Private Employment Agency,MATEA P CANAS,Valid License,2446210 / 09274692150,www.quantumworkabroad.com
13 ESCALER ST VARSITY HILLS LOYOLA HEIGHTS QC ,,to,QUARTZ CONSTRUCTION & DEVELOPMENT CORPORATION Construction Contractor,ENGR EULALIO GANZON,Cancelled,967556 / 967566,
"G/F, NO. 4598 J. DELA CRUZ COR CASINO STREETS PALANAN, MAKATI",arcangel_an@yahoo.com,9/3/2015 to 9/2/2019,QUEEN OF THE OCEAN SHIPPING CORP Manning Agency,ALEXANDER M NUNEZ JR,Valid License,8334295 / 09178216367,NA
2F-B DON JOSE BDG 533 FLORES COR GREY STS ERMITA ,,8/28/1998 to 8/26/2000,QUEEN`S INTERNATIONAL PLACEMENT CENTER INC (NORTHERN INT`L PLACE`T CENTER) Private Employment Agency,ZOSIMO CABULISAN,Delisted,5257520 / 5237329,
"8071 ESTRELLA AVENUE SAN ANTONIO VILLAGE, MAKATI",resource@questcore.com.ph,3/14/2017 to 3/13/2021,QUESTCORE INC Private Employment Agency,REA ELIZABETH B.CRISTOBAL,Valid License,8992384 / 8992385/ 09999932179,www.questcore.com.ph
"53/F PBCOM TOWER AYALA AVENUE MAKATI CITY AYALA, MAKATI",NA,10/7/2008 to 10/7/2009,QUESTHIGHLANDS INC Private Employment Agency,BERNADETTE D. GUNDRY,Delisted,8164972,NA
GF1A & UB(GF/2F) 451 BONI AVE MANDALUYONG CITY MANDALUYONG,quintiniansplacement@gmail.com,8/26/2014 to 8/25/2018,QUINTINIANS PLACEMENT AGENCY INC Service Contractor,MS MYRNA T REYES,Valid License,5329934/ 5311575,None
4226 LAREDO ST PALANAN MAKATI,quintrixmanpower@yahoo.com,6/17/2014 to 6/16/2018,QUINTRIX INTERNATIONAL MANPOWER CENTER INC Service Contractor,MS ROWENA D AL HANAKI,Suspended (Document Processing),8313716/ 7299115/ 09175002638/ 09478902526,www.quintrixmanpower.com
"7/F FERGUSON PARK TOWER MH DEL PILAR COR. A FLORES ERMITA, MANILA",info@gyroncrew.com,11/13/2015 to 11/12/2019,"QUNCREW INC (FORMERLY GYRON CREW, INC.) Manning Agency",MS RUTH S VILLASIS,Valid License,5262050 / 5262051,None
"NO 8 SALINAS DRIVE LAHUG CEBU CITY, CEBU",None,11/6/2001 to 11/6/2003,R & R JOB PLACEMENT AGENCY CORP. Private Employment Agency,ROSANNA R SAN GABRIEL,Delisted,2335872 / 2335871,None
STE 1104-1106 VV SOLIVEN BLDG EDSA SAN JUAN M.M. ,,to 4/30/1986,R & T WORLDWIDE PLACEMENT & GENERAL SERVICES Service Contractor,MS TERESITA M TIGLAO,Forever Banned,9212203,
"2/F & 4/F, MRDC BLDG, 85 BUENDIA AVENUE PALANAN, MAKATI",ralcareerlinkinc@gmail.com,7/12/2016 to 7/11/2020,R A L CAREER LINK INC. Private Employment Agency,ROBERTO S. PALER,Valid License,8874629/886-5345/ 3942665,www.ralcareerlink.com
M05 PRINCE JUN COND 42 TIMOG AVE BRGY LAGING HANDA QUEZON CITY,None,7/18/2016 to 3/18/2018,R.D. INTERIOR JUNIOR CONSTRUCTION Construction Contractor,RICARDO D INTERIOR JR,Valid License,3714518/3734045,None
"4F ELENA III BLDG., 1865 F. BENITEZ ST. MALATE, MANILA",None,12/2/2001 to 12/1/2003,R.F. HORIZON RECRUITING AGENCY CORP Private Employment Agency,AMELIA S GABRIEL,Cancelled,4041823-24,None
CLUSTER 1 GF U-11 SAN FRANCISCO GARDENS BONI AVE MANDALUYONG,rvpersonnel@gmail.com,9/21/2006 to 9/21/2010,R.V. PERSONNELS INC Private Employment Agency,RAMON V. VILLANUEVA,Cancelled,5354255 TELEFAX,NA
"2/F, ARC BLDG, 1916-A LEON GUINTO ST MALATE, MANILA",rvt_agency@yahoo.com,1/30/2015 to 1/29/2019,R.V. TRIA INTERNATIONAL RECRUITMENT AGENCY Private Employment Agency,RUSTICO V TRIA,Valid License,710-8562/ 09989822337(mobile),None
Blk.10 L-8 C. Muñoz Palma St. BF Resort Vill. LP ,None,2/19/2003 to 2/19/2005,R.V.J. MANNING & SHIPPING SERVICES Manning Agency,"RICARDO V. JORGE, JR.",Cancelled,8736606,None
KAPITAN TIAGO ST RIZAL VILL ALABANG ,,4/20/1994 to 4/20/1996,RAC INTERNATIONAL MANAGEMENT SERVICES  Service Contractor,ROMULO CHAVEZ,Delisted,,
KAPITAN TIAGO ST RIZAL VILL ALABANG ,,to 10/29/1989,RAC INTERNATIONAL MANAGEMENT SERVICES  Private Employment Agency,MR ROMULO A CHAVEZ,Delisted,,
*U210 ESTRELLA COND 858 SAN ANDRES MALATE MANILA ,None,3/1/2003 to 2/28/2007,RACKY INTERNATIONAL ARTISTS MANPOWER SERVICES Private Employment Agency,ALEX P. PINON,Cancelled,5248893/ 4006148/ 5248907/ 3034097/ 4004641,None
"S32&33,3F,LEGASPI TWRS 300,ROXAS BLVD COR P OCAMPO MALATE, MANILA",radialgolden@email.com/ rgmsc_phils@yahoo.com.ph,5/21/2014 to 5/20/2018,RADIAL GOLDEN MARINE SERVICES CORPORATION (FOR LIGHTHOUSE INTL SHPG CORP) Manning Agency,ALELI D SANCHO,Valid License,5276633 / 5275930,NA
22 LIBERTAD ST MANDALUYONG CITY ,,1/8/1988 to 1/8/1990,RADIUM CONSTRUCTION CORPORATION  Construction Contractor,MR OCTAVIO M MANLEGRO,Delisted,799520 / 791386,
9/F R.MAGSAYSAY CTR BLDG 1680 ROXAS BLVD MM ,,to 3/8/1986,RAGAY GULF DEVELOPMENT CORPORATION  Construction Contractor,MR STEPHEN CHUA,Cancelled,502051,
"RMS 1&2&3&7 RENADAR BLG.1360L.GUINTO ST. ERMITA, MANILA",rajaam_agency@yahoo.com,2/15/2004 to 2/14/2008,RAJAAM RECRUITMENT AND PLACEMENT AGENCY INC Private Employment Agency,UKOL TUMOG TALUMPA,Cancelled,5239971/5228752/5251953,None
3/F CALDERON BLDG 827 EDSA DILIMAN QUEZON CITY ,,to,RAJAH MULTI-SERVICES  Private Employment Agency,MR ROLAND R ROMERO,Inactive,,
RM.106 HARMONY HOMES SANDEJAS ST VITO CRUZ MANILA ,,to 2/27/1985,RAMADA ENTERPRISES INC  Private Employment Agency,MR GERARDO SERVANDO JR,Forever Banned,,
"UNIT 8, AGONCILLO TOWNHOMES II,1627 F AGONCILLO ST MALATE, MANILA",rmsmanila@yahoo.com,4/12/2016 to 4/11/2020,RAMASIA INTERNATIONAL MANPOWER SERVICES INC. (FOR:RAMASIA MANPOWER SERVICES Private Employment Agency,DOMINGA D BRUN,Valid License,2440978/ 5169099,FB Acct
"3/F, LLIZK BLDG, 428 UNITED NATIONS AVENUE ERMITA, MANILA",rapidmanpower@pldtdsl.net,9/12/2015 to 9/11/2019,RAPID MANPOWER CONSULTANTS INC Private Employment Agency,MR PRECIOSO R PERLAS,Valid License,5256684/ 5256687/ 5259110/ 5259111/ 09174238418,NA
"S206,206A 209 & 211 L & S BLDG, 1414 ROXAS BLVD ERMITA, MANILA",info@raqeebasia.com / recruitment1@raqeebasia.com,3/8/2016 to 3/7/2020,"RAQEEB UNIVERSAL, INC. (RAQEEB MANAGEMENT ENT.) Service Contractor",MS AMMAL G RAQEEB,Valid License,5221616 / 5221717/ 0917-8481616/ 092096776(mobile),None
1169 LEON GUERRERO ST ERMITA MANILA ,,to 10/20/1988,RASID RECRUITMENT & EMPLOYMENT AGENCY INC Private Employment Agency,ENGR APOLINARIO C MILANES,Forever Banned,,
2278 L.GUINTO ST MALATE MANILA ,,to 11/22/1985,RASILI MANAGEMENT & CONSTRUCTION SYSTEMS Service Contractor,MR RAMON S LIM,Cancelled,5217745 / 5217790,
RM.41 MATRINCO BLDG 2178 PASONG TAMO MAKATI ,,to 5/24/1986,RAYDECO INTERNATIONAL DEVELOPMENT & EMPLOYMENT CORPORATION Private Employment Agency,MR DOROTEOB JACOB JR,Delisted,8311332,
MISONOVA BLDG 1418 SAN MARCELINO ST MALATE ,,to 12/19/1984,RAYOMAR MANAGEMENT INC  Manning Agency,MR RAMON C GARCIA,Delisted,,
16 J.P.LAUREL ST XAVIERVILLE QUEZON CITY ,,5/18/1996 to 5/17/1998,RAYPIN MANPOWER INTERNATIONAL INC  Service Contractor,MR PABLO P PINPIN,Delisted,983479 / 971928,
"SUITE 207 & 209 (2F) AURORA PLAZA, ARQUIZA COR J B ERMITA, MANILA",raysa.agency@yahoo.com,6/19/2012 to 6/18/2016,RAYSA INTERNATIONAL SMART EMPLOYMENT SERVICES (RISES) CORP (FORMERLY RAYSA Private Employment Agency,REX S. MADERSE,Cancelled,3109726,NA
SURESTE BLDG 116 RADA ST LEGASPI VILL MAKATI ,,to 8/14/1986,RAZON INTERNATIONAL STEVEDORING CORPORATION Service Contractor,MR ENRIQUE RAZON,Delisted,,
3450 GRACIA COR EDSA BGY PINAGKAISAHAN MAKATI ,,8/26/1992 to 8/25/1994,RBA & ASSOCIATES INC  Private Employment Agency,MS INOCENCIA G BORROMEO,Delisted,8130016 / 8130018,
613 CALDERON ST MANDALUYONG METRO MANILA ,,to 12/31/1982,RC GONZALES COMPANY INC  Construction Contractor,MR RAMON C GONZALES,Cancelled,782041 / 782042,
UNIT 103- H FIVE E-COM CTR BLDG HARBOR DRIVE MOA PASAY CITY,myrclmanila@rccl.com,6/3/2016 to 6/3/2020,RCCL CREW MANAGEMENT INC Manning Agency,GERARDO ANTONIO BORROMEO,Valid License,,None
"2210 TEJERON ST.COR.REVELLIN ST.STA.ANA,MANILA ",,4/12/1996 to 4/11/1998,RCF PROMOTIONS & PLACEMENT AGENCY CO LTD  Private Employment Agency,ATTY ROBERTO RAMIN,Delisted,5233547,
420-I WHITE HOUSE COND CORNER BAYANI ST ARANETA QC ,,to 11/5/1987,RCM INTERNATIONAL MANPOWER & GENERAL SERVICES Private Employment Agency,MS ROSALIA C MALLILIN,Forever Banned,602918 / 612662,
RMS C&E RAMAGI BLDG 1081 PEDRO GIL ST PACO  ,rcpaakm@hotmail.com,4/21/2004 to 4/20/2008,RCPA BUSINESS VENTURES Service Contractor,RAQUEL M ROBINSON,Cancelled,5217756/5366518,None
"SPACE 1&4, G/F, 2010 BENITEZ ST. COR. QUIRINO AVEN MALATE, MANILA",rcs2014@yahoo.com,6/22/2016 to 6/21/2020,RCS PROMOTION & OVERSEAS PLACEMENT INC Private Employment Agency,MS CYNTHIA G ANDRES,Valid License,5331382,None
592 M.DE LA FUENTE ST SAMPALOC MANILA ,,to 7/24/1981,RD RIVERA CONSTRUCTION INC  Construction Contractor,MR RENATO RIVERA,Cancelled,485218 / 485743,
"R211,305,306&412 GEDISCO CTR 1564 MABINI ST ERMITA, MANILA",None,1/27/2004 to 1/26/2008,RDRI INTERNATIONAL MANPOWER Private Employment Agency,MR ROY MANALAD,Cancelled,5267173/ 4009449,None
"2F,PARAISO BLG, 36 ALABANG-ZAPOTE ROAD ZAPOTE, LAS PIÑAS",reachmanpower@gmail.com,6/2/2015 to 6/1/2019,REACH MANPOWER INTERNATIONAL INCORPORATED Private Employment Agency,RICHARD P. HOEY,Cancelled,8711601/8712978/0923-6311837,www.reachmanpower.workabroad.ph
"U-510 PRES TOWER 81 TIMOG AVE QUEZON CITY DILIMAN, QUEZON CITY",NA,11/21/2011 to 5/20/2012,REAJENT MANPOWER SERVICES INC Private Employment Agency,RAUL P. ALARCON,Cancelled,4116759/4116760,reglobal.us
RUIZ-ENTENA BLDG 650 QUEZON AVENUE QUEZON CITY,INFO@REALMEDINTERNATIONAL.COM,11/5/2007 to 5/4/2008,REALMED INTERNATIONAL RECRUITMENT AGENCY INC Private Employment Agency,ELEUTERIO A. MEDINA,Cancelled,7416466/7431562,WWW.REALMEDINTERNATIONAL.COM
"R214,315,410,412 & PH5A&5B GEDISCO, 1564 A.MABINI ERMITA, MANILA",REALWORLD_ERMITA412@YAHOO.COM,11/15/2006 to 11/14/2010,REALWORLD CORPORATION Private Employment Agency,RICHARD P REAL,Cancelled,5214139/4501374,None
95-F FELIX MANALO ST CUBAO QUEZON CITY ,,to 11/8/1985,RECRUITMENT & PLACEMENT CORPORATION OF THE PHILIPPINES Private Employment Agency,MR FELICIANO A REYES JR,Forever Banned,995861,
"UNIT C & D LOWER GROUND FLOOR THE GLASS TOWER BLDG MAKATI, MAKATI",info@rcphil.com,7/27/2014 to 7/26/2018,RECRUITMENT CENTER PHILIPPINES INC FORMERLY VETERANS OVERSEAS PLACEMENT COR Private Employment Agency,AURELIO R BAUTISTA JR,Valid License,8009098,www.rcphil.com
1911 SAN MARCELINO ST ERMITA MANILA ,,10/13/1993 to 10/13/1995,RECRUITMENT SYSTEM & SERVICES INC  Service Contractor,,Delisted,,
205 HERITAGE COND DR.A.VASQUEZ MALATE MANILA ,,to 12/10/1985,RED BUILDERS INC  Construction Contractor,MS CORA S DOLZ,Forever Banned,572659 / 591786,
"G/F & 2/F 1736 E DIAN STREET PALANAN, MAKATI",info@redsand.ph,4/20/2017 to 4/20/2019,REDSAND RECRUITMENT INTERNATIONAL MANPOWER INC Private Employment Agency,MARY ROSE F DELGADILLO,Valid License,(02) 8357488,www.redsand.ph
802 L & S BLDG 1414 ROXAS BLVD MANILA ,,4/18/1998 to 4/18/2000,REDWOOD SHIPPING CORPORATION  Philippine Registered Vessel,MRS ANGELITA T RIVERA,Inactive,5219567 / 5219568,
"U1 GF MANOR BLG TAFT AVE MALATE, MANILA",regalvision@yahoo.com/regal_vision@yahoo.com,12/28/2007 to 12/27/2011,REGAL VISION INTERNATIONAL MANPOWER SVCS CORP (FOR.C.A.M. INTL) Private Employment Agency,MYRA A. SHIMO,Cancelled,525-2080/387-2616,www.regalvisionmanpower.com
"3F U-4-B 2686 SOUTH AVE, OLYM- PIA VILL MAKATI ",,4/19/1999 to 4/19/2001,REGINA PERSONNEL MANPOWER INC.  Private Employment Agency,PAMELA J BERGANTIN,Delisted,8968542 / 8901217,
2211-2219 ESPANA BOULEVARD SAMPALOC MANILA ,,8/24/1996 to 8/23/1998,"REHABCARE PHILIPPINES, INC.  Service Contractor",DR TYRONE M REYES,Delisted,7311087,
"UNIT N, VIOLETA COURT, 2814 FB HARRISON ST. PASAY CITY",fesalano@reignmarine.com,5/18/2016 to 5/17/2020,REIGN MARINE SHIPPING AGENCY CO INC (LIBERTY MARINE SHIPPING CO INC) Manning Agency,LEO ENRICO S. SALANO,Valid License,8331964/831-8133,www.reignmarine.com
U1201-1203 PARAGON PLAZA 162 EDSA-RELIANCE MANDALUYONG,reinpaci@reinierpacific.com,5/8/2016 to 5/7/2020,REINIER PACIFIC INTERNATIONAL SHIPPING INC Manning Agency,CAPT AMADO L CASTRO JR,Ceased Operations,6875224/ 09284280469/ 09771408341,www.reinierpacific.com
"R316&318 (3F) GEDISCO CTR, 1564 A MABINI ST ERMITA, MANILA",rejoice.manpower@gmail.com,7/18/2015 to 7/17/2019,REJOICE EMPLOYMENT INTERNATIONAL CORP. Private Employment Agency,RITCHEL V QUINTON,Suspended (Document Processing),4501535/4501131/ 09175741580,NA
"STE.14, GF MIDLAND PLZ ADRIATICO ERMITA ",,6/17/1997 to 6/16/1999,RELEX INTERNATIONAL SERVICES  Private Employment Agency,REYNALDO Z TAPNIO,Delisted,5360708 / 5366907,
"U807 PEARL OF THE ORIENT BDG 1240ROXAS BLVD MANILA ERMITA, MANILA",NA,4/20/2009 to 4/20/2010,RELIABLE CHOICE PLACEMENT INC Private Employment Agency,SUSANA S. MEDINA,Delisted,7102516,NA
"RM 501, PIERRE & PAUL BLDG, 505 A MABINI COR A FLO ERMITA, MANILA",reliable1980@yahoo.com,6/17/2014 to 6/16/2018,RELIABLE RECRUITMENT CORPORATION Private Employment Agency,MR ZOSIMO S CABULISAN,Valid License,5222188/ 5251935/ 5216119/ 09228812413,www.reliablerecruitment.com
RM.714 MANUFACTURERS BANK BLDG STA.CRUZ MANILA ,,7/3/1990 to 6/29/1992,RELIANCE INTERNATIONAL SERVICES & ENTERPRISES Service Contractor,MS RUFINA C LEGASPI,Delisted,,
SUITE 303 TAN BLDG 15 NEW YORK QUEZON CITY ,,to 8/27/1985,REMIGIO R RIGOR CONSTRUCTION INC  Construction Contractor,MR REMIGIO R RIGOR,Cancelled,791609,
481 SINAGOGA ST MALATE MANILA ,,10/14/1996 to 10/13/1998,REMPAC PLACEMENT AGENCY  Private Employment Agency,CRISPINIANO P DELOS REYES,Delisted,5251201,
"U4&5(3F) & U1(4F) AVANT BLG, 48 JUPITER COR MARS BEL-AIR, MAKATI",NA,6/30/2010 to 6/29/2014,RENAISSANCE STAFFING SUPPORT CENTER INC Private Employment Agency,ALLEN G. MOJICA,Cancelled,897-7189/897-7193/899-0916/899-8550,NA
4986 P GUANZON BGY POBLACION MKT AVE MAKATI,None,11/26/2003 to 11/25/2007,REN-GLO ENTERPRISES PLACEMENT AGENCY Private Employment Agency,ATTY RENATO C TOMAS,Cancelled,8996564/8960546,None
"S-5,21&17 MIDLAND PLAZA HOTEL M. ADRIATICO ERMITA ",,2/2/2000 to 1/19/2002,RENNA INTERNATIONAL MANPOWER SERVICES  Private Employment Agency,NENITA T TUMBOKON,Delisted,5259033,
UNIT 309 PANORAMA BLDG 825 EDSA SOUTH TRIANGLE QUEZON CITY,arnold@rensol.com,4/28/2015 to 4/28/2019,RENSOL RECRUITMENT AND CONSULTING INC Private Employment Agency,ARNOLD ROBILLOS MAMACLAY,Valid License,931-0968 / 09178213037,www.rensol.com
3794 CUENCA ST PALANAN MAKATI CITY ,,8/25/1992 to 8/25/1996,RESMA AMORA PLACEMENT  Service Contractor,WENEFREDA RESMA AMORA,Delisted,8313304 / 8331718,
4/F J&S BLDG 104 KALAYAAN AVENUE QUEZON CITY QUEZON CITY,NA,10/11/2009 to 4/10/2010,RESOURCE ONE GLOBAL PARTNERS INC Private Employment Agency,AUGUSTUS V. SALGADO,Delisted,9293375/9271701,NA
117 AGUIRRE ST LEGASPI COMM`L VILL MAKATI,,5/17/1990 to 4/27/1991,REYES & LIM COMPANY INC  Philippine Registered Vessel,,Delisted,8104636 / 8104640,
UNIT 4 PALM COURT ST PASAY CITY,None,6/6/2001 to 6/5/2003,REYNA FILIPINA PLACEMENT MANAGEMENT SERVICES CORP. (FOR: MATABALAO REC`T & Private Employment Agency,MILDREN A FUNDAN,Delisted,8338136 TELEFAX,None
"4TH FLOOR, ACC BLDG, SANDAWA PARK, QUIMPO BLVD, MA N.S.",NA,8/2/2016 to 8/1/2020,REYNA SHIPPING SERVICES INC Manning Agency,EARL VINCENT G CALMA,Valid License,(082) 2953840 (TELEFAX),NA
1784 A.MABINI ST MALATE METRO MANILA ,,to,RF PLACEMENT CENTER  Private Employment Agency,MR RENATO FORONDA,Cancelled,,
203 SPEAKER E.PEREZ ST QUEZON CITY ,,to 8/23/1985,RG REYES BUILDERS & CONTRACTORS CORPORATION Construction Contractor,MR REYNALDO G REYES,Cancelled,612659 / 625789,
87-C 12TH AVE CUBAO QUEZON CITY ,,7/27/1995 to 1/27/1996,RG-DIAMOND OVERSEAS INTEGRATED SERVICES INC Private Employment Agency,MS GLORIA P ANTE,Delisted,9120263 / 9120264,
R.LIWAG BLDG 1258 BATANGAS ST SAN ISIDRO MAKATI ,,3/8/1998 to 3/6/2000,RGE CONTRACTING SERVICES CORPORATION  Service Contractor,JOAHNALYN T MENDOZA,Delisted,8441927 / 8439357,
EB DEVCOR BLDG 79 M HEMADY COR 13TH ST NEW MLA QC ,,7/3/1986 to 8/8/1987,RHEN WATERWAYS INC  Philippine Registered Vessel,GEN SEGUNDO P VELASCO,Delisted,,
"UNIT B,1727 TOMAS CLAUDIO ST, BRGY BACLARAN PARAÑAQUE",rhvplacementagency@yahoo.com,2/8/2015 to 2/7/2019,RHV PLACEMENT AGENCY INTL INC Private Employment Agency,NATALIO E EBUENG,Valid License,8863713 / 09497939323/ 09278220938,www.rhvplacementagency.com
*2205 LEVERIZA ST PASAY CITY ,,7/6/1990 to 6/22/1992,RICH MARITIME MANAGEMENT INC  Manning Agency,RHODERICK S JURADO,Delisted,,
"G/F, 2175 VILLALON SUBD, ANDRES ABELLANA EXTENSION CEBU",richellepower@ymail.com,11/3/2014 to 11/3/2018,RICHELLE MANPOWER AGENCY CO. Private Employment Agency,RACHELLE I ERAMIS,Valid License,(032) 520-3554/ 09088697234,www.richelle-manpower.com
"R203,204,306&404 VAREB MANSION, 1679 A. MABINI ST MALATE, MANILA",RICHFIELDOVERSEAS@YAHOO.COM,7/6/2007 to 7/6/2011,RICHFIELD OVERSEAS EMPLOYMENT CO Private Employment Agency,HELEN T. TULINAO,Cancelled,4508334/4508677,NA
"U1&2 JNL BLG,C.P.GARCIA HIWAY & MAMAY RD,BUHANGIN DAVAO CITY, DAVAO DEL SUR",None,8/4/2006 to 2/4/2007,RICHKEEPER EMPLOYMENT CENTER Private Employment Agency,VALENTINA E. MAGAT,Delisted,(082) 2412348/2410468,None
"UNIT 201(2F) AND UNITS 302, 306, 307 & 308 (3F), S MALATE, MANILA",richland_intl2015@yahoo.com,1/30/2015 to 1/30/2019,RICHLAND INT`L. MANPOWER SPECIALIST COMPANY Private Employment Agency,CARMEN G TOLEDANA,Valid License,7080915 / 7114803 / 09205275139,N/A
"RM.714,715 R SANTOS BLDG PLAZA LACSON MANILA ",,12/28/1997 to 12/27/1999,RICHSHIP MANAGEMENT (MANILA) INC  Manning Agency,MR MARCELINO B BAQUIRAN,Delisted,4002779 / 481206,
"UNIT 3, 8/F, ASEANA ONE, BRADCO AVENUE, ASEANA CIT PARAÑAQUE",manilacrewing@rickmers.com,12/10/2017 to 12/9/2021,RICKMERS MARINE AGENCY PHILIPPINES INC (FORMERLY FOERDE MARINE AGENCY INC) Manning Agency,CAPT ALLAN R SARMIENTO,Valid License,5197561 ext 100,www.rickmers.intern.com
152-154 LOPEZ RIZAL ST MANDALUYONG MM ,,to,RICONSU INTERNATIONAL CONSTRUCTION INC  Construction Contractor,MR JOSE GOCHOCO,Inactive,,
"RMS 263, 264,265, 267, 268 & 269 RAMAGI BLDG, 108 PACO, MANILA",ridzkeyresources@yahoo.com,10/25/2012 to 10/24/2016,RIDZKEY HUMAN RESOURCES INTERNATIONAL SERVICES Private Employment Agency,CHENY O. VENIDA,Cancelled,5248596/5254067,NA
"GF, BF PAJO BLG, M.L. QUEZON, BRY PAJO, LAPU-LAPU CEBU",manning@rieltmaritime.com.ph,8/15/2016 to 8/14/2020,RIELT MARITIME INC Manning Agency,CAPT REYNOLD L TORRES,Valid License,520-9209/ 340-6274,www.rieltmaritime.com.ph
"1131 A MABINI ST U202 PIERRE N PAUL BLG ERMITA, MANILA",rileyinternational_employment@yahoo.com,8/29/2008 to 8/29/2012,RILEY INTERNATIONAL EMPLOYMENT SERVICES AND TRAINING CENTER INC (FORMERLY A Private Employment Agency,SHERLIDA R. VILLANUEVA,Cancelled,5365640 / 5254917,NA
101D VM TOWER 727 ROXAS BLVD PARANAQUE MM ,,7/9/1993 to 7/9/1995,RIM INTERNATIONAL MANPOWER RESOURCES CORPORATION Service Contractor,MS MILA P TOLENTINO,Delisted,8341325 / 8314044,
"G/F, CSL BLDG., 1919 F. AGONCILLO ST. MALATE, MANILA",rise@risemanpower.com,3/19/2016 to 3/18/2020,RISE MANPOWER SERVICES INC Service Contractor,ROSE MARIE P LAINEZ,Valid License,5365496 / 09178069872,www.risemanpower.com
"DNS BLDG 5061 FILMERA COR ARELLANO AVE PALANAN, MAKATI",RISING_SUN @ PLDT.DSL.NET,3/29/2005 to 3/29/2006,RISING SUN INT`L HUMAN RESOURCES INC. Private Employment Agency,WILFREDO P. REYES,Delisted,8325870-71,NA
"4/F EMPIRE CTRE, 245-247 EDSA EXT, TAFT ROTONDA PASAY CITY",ritemerit@gmail.com,12/29/2015 to 12/28/2019,RITE MERIT INTERNATIONAL MANPOWER CORPORATION Private Employment Agency,LIGAYA P BONAVENTE,Valid License,8229329/ 8018740/ 0917-3653459,www.ritemerit.com
"S10,11(G/F) & 20 (2/F) MIDLAND PLAZA ADRIATICO ST ERMITA, MANILA",None,11/30/2006 to 11/29/2010,RITZ MANPOWER SERVICES Private Employment Agency,MS RITA G GAGUI,Cancelled,5240938/ 5232705,None
3F&4F (LW) RIZAL TOWERS 4474 SINGIAN ST MAKATI,None,8/2/2002 to 8/1/2004,"RIZAL INTERNATIONAL SHIPPING SERVICES, INC. Manning Agency",ROLANDO ANTIPORDA,Delisted,8999219/ 8993907,None
12-B MAPAGMAHAL ST PI#AHAN QUEZON CITY ,,to 7/1/1984,RJ DAVID CONSTRUCTION  Construction Contractor,MR ROBERTO J DAVID,Inactive,,
"UNITS 3A, 3E, 3F & 3I, JAYO COMMERCIAL BLDG, RIZAL PANGASINAN",admin@rjcglobalph.com,12/20/2016 to 12/20/2018,RJC GLOBAL MANPOWER PROVIDER INC Private Employment Agency,RHEA M CHUA,Valid License,(075)540-6413 / 09393856665,www.rjcglobalph.com
RM.402 PLYWOOD INDUSTRIES BLDG TM KALAW ST MANILA ,,to 11/5/1977,RJG DEVELOPMENT CORPORATION  Service Contractor,MS MARIA J EDURESE,Cancelled,,
4/F SUMMERLIN BLDG 2454 FB HARRISON COR VALHALLA PASAY CITY,rm.advent@yahoo.com.ph,1/11/2018 to 1/10/2022,RM ADVENT GLOBAL SERVICES INC Private Employment Agency,DRA JOCELYN C LAPAT,Valid License,8042694/0929-8891600/0926-7200290(mobile),www.rmadvent.com
NO.5 QUEEN ROAD MANDALUYONG CITY ,,to 11/16/1985,RM INTERNATIONAL SHIPPING COMPANY LTD  Manning Agency,MR CESAR C TONIDO,Forever Banned,,
LACHICA BLDG 2421 GEN OSMALIK BALAGTAS PANDACAN MM ,,to 3/23/1986,RM LACHICA ENTERPRISES (INTERNATIONAL)  Private Employment Agency,MS ROSALINDA M LACHICA,Forever Banned,585474 / 580045,
"G/F VERMONT TOWERS J.NAKPIL ST MALATE, MANILA",,12/19/1993 to 12/18/1995,RM MONTEYRO & ASSOCIATES INC  Private Employment Agency,LT COL ROMEO M MONTEYRO,Delisted,5210897,
SABAS ALMEDA BLDG A.FLORES COR A.MABINI STS ERMITA ,,to 7/12/1986,RMCA BUSINESS COMMERCIAL  Service Contractor,MR ROMEO MERCADO,Forever Banned,,
2781 NEW PANADEROS ST STA.ANA MANILA ,,12/19/1991 to 12/19/1993,RMF INTERNATIONAL PLACEMENT INC  Service Contractor,MR ROLANDO P MALIG,Delisted,,
"GF,MF,R209,301&305 A. SANTOS BLG 1392 GEN LUNA ST PACO, MANILA",ALNEGS@YAHOO.COM,5/17/2007 to 5/16/2011,RML INTERNATIONAL SERVICES Private Employment Agency,RENATO T LAPUZ,Cancelled,5284973/4981114/5253671,None
3/F DON JOSE BLDG 531 A.FLORES COR GREY ST ERMITA ,,1/28/1994 to 7/26/1996,RMR RECRUITMENT AGENCY COMPANY  Service Contractor,MS ROSITA M RAFAEL,Delisted,501167 / 587368,
"RM 307, 3/F, DISCOVERY PLAZA COMMERCIAL CENTER, 16 MALATE, MANILA",rmz@yahoo.com,9/15/2017 to 3/14/2018,RMZ INTERNATIONAL MANPOWER SERVICES CO Private Employment Agency,ROBERTO MERCADO ZARAGOZA,Valid License,0916-4656617,None
"UNIT 103, GF, RICHMOND BLG, 6 NEW YORK ST, BRGY IM CUBAO, QUEZON CITY",RNJOB_06@YAHOO.COM,8/18/2014 to 8/17/2018,RN JOB QUEST Private Employment Agency,LEMUEL F. IGNACIO,Valid License,242-1427,NA
2236 LEON GUINTO ST MALATE MANILA ,,to 9/11/1987,ROAN PHILIPPINES INC  Manning Agency,MS MAGDALENA IRONS,Forever Banned,,
3/F PIFCO BLDG 2300 PASONG TAMO ST MAKATI,,3/29/1988 to 3/29/1990,ROBLETT INDUSTRIAL CONSTRUCTION CORPORATION Construction Contractor,MR ROBERTO G ABIERA,Delisted,882601 / 867642,
"M-1557 LUZ J. HENSON BLDG, 1555 A. MABINI ST ERMITA, MANILA",manuel.calixto@rochartgroup.com,10/12/2014 to 10/11/2018,ROCHART GLOBAL RESOURCE CENTER Private Employment Agency,NEDGARDO B. BERGADO,Cancelled,7016654/7016259,www.rgrcstaffing.com
"RMS 206,207,208,210 &212,2F FEDERATION CENTER BLG BINONDO, MANILA",rocksol@pldtdsl.net/rocksolidmanpower@hotmail.com,7/26/2015 to 7/25/2019,"ROCK SOLID MANPOWER NETWORK & CONSULTANCY, INC. Private Employment Agency",MS LOLITA L CHUA,Valid License,2411102 / 2418545 / 2418551 / 09175188428,www.rocksolidmanpower.com
238 UNIT-A VITO CRUZ EXTENSION MAKATI,,10/24/1995 to 10/23/1997,ROLLING HILLS RESOURCES & DEVELOPMENT CORPORATION Private Employment Agency,MR RICARDO GUZMAN,Delisted,882947,
UNIT 2 EMERALD SQUARE COMPLEX JP RIZAL PROJ. 4 QC ,,6/21/2004 to 6/20/2008,ROMA INTL. PLACEMENT CORP.  Private Employment Agency,CLARITA V. MAGABO,Delisted,4318380 / 9114367,
208 PILAR ST MANDALUYONG METRO MANILA ,,to,ROMAGO ELECTRICAL COMPANY INC  Construction Contractor,MR FRANCISCO GONZALES,Inactive,,
SUITE 12-G E.ANTONINO BLDG TM KALAW ST ERMITA ,,to 12/28/1984,ROMAN INTERNATIONAL SERVICES  Private Employment Agency,MR RODOLFO G MANIQUEZ,Forever Banned,583481 / 583519,
"UNIT 915-B, RSAG BLDG, 915 AURORA BLVD CUBAO, QUEZON CITY",info@romaroverseas.com,4/12/2016 to 4/11/2020,ROMAR OVERSEAS PLACEMENT & TRADING CORPORATION Private Employment Agency,EDITHA OÑATE,Valid License,709-7144 telefax/ 0947-8970992 (mobile),www.romaroverseas.com
2042/2044 PRES. QUIRINO AVE PANDACAN MANILA ,,4/18/1998 to 4/16/2000,"RONA MANPOWER SERVICES, INC.  Private Employment Agency",MR ROLANDO TORRES,Delisted,5649469 / 5638490,
"B-3 COOYEESAN HOTEL PLAZA 1,NAGUILIAN RD BAGUIO CITY, BENGUET",NA,10/29/2008 to 10/28/2012,ROSCHAZZ U.K. PLACEMENT CONSULTANCY Private Employment Agency,ELSIE L. MEEPEGAMA,Cancelled,(074) 444-8389,NA
"RMS 400,404,408A,410 & 419, 4F, GEDISCO CENTRE ERMITA, MANILA",rotana_mainoffice@yahoo.com,6/10/2014 to 6/9/2018,ROTANA INTERNATIONAL MANPOWER INC (FORMERLY EASTERN MAARS RESOURCES INC) Private Employment Agency,,Suspended (Document Processing),257-1309/0929-4444449/0929-4444419,None
"777-D AURORA BLVD. CUBAO, QUEZON CITY",None,8/29/2000 to 8/4/2002,ROUND STAR PLACEMENT PROMOTION INTERNATIONAL Private Employment Agency,HELEN E GAPIDO,Delisted,7248219 / 4118448,None
1776 DIAN ST MAKATI METRO MANILA ,,to 11/5/1983,ROVENOR SHIPPING AGENCY  Manning Agency,MS ANUNCIACION P RAMOS,Cancelled,7417893,
"RM 701-A MANUFACTURERS BLDG PLAZA STA. CRUZ, MANILA",rsms02@hotmail.com,5/9/2004 to 5/8/2008,ROVER MARITIME SERVICES CORP  Manning Agency,RUEL A. BENISANO,Delisted,7365166,None
6 ORION ST MAKATI CITY ,,10/27/1991 to 10/27/1993,ROXAS ELECTRIC & CONSTRUCTION INC  Construction Contractor,EMMANUEL B ROXAS,Delisted,887210 / 887625,
