Address,Email Address,License Validity,Name,Official Representative,Status,Tel No/s,Website
3F OJEN BLDG. 464 BONI AVENUE MANDALUYONG,info@deltavir.com.ph,3/25/2016 to 3/24/2020,DELTAVIR OVERSEAS JOB PLACEMENT & GENERAL SERVICES INC Private Employment Agency,MARIO M. ALMAZORA,Valid License,5316598/ 5316648/ 5338528/ 09176310066,www.deltavir.com.ph
"SUITE A,B&C, TAFT BUSINESS CTR, 2143-2159 TAFT AVE MALATE, MANILA",admin@dis.com.ph,10/26/2015 to 10/25/2019,DESERTWEALTH INT`L SERVICES CORP (INDUSTRIAL MANPOWER ENT COMPANY) Private Employment Agency,MR VICENTE M MADAMBA,Valid License,230-4012/ 230-3323/ 0919-6240806,www.desertwealth.com
"RMS306,401A,404B & 410 GEDISCO CTR1564 A MABINI ERMITA, MANILA",None,5/7/2002 to 5/7/2004,DESTINATION PLACEMENT AGENCY Private Employment Agency,REYNALDO L SOLIS,Cancelled,5234291,None
"3/F (R/W) 1787 BELEN BUILDING MABINI STREET MALATE, MANILA",DTDW.marketing@gmail.com,6/13/2017 to 6/13/2019,DESTINY TWIN DRAGON WORKFORCE CO LTD Private Employment Agency,MA JOCELYN P ASONG,Valid License,09172470237,None
PLYWOOD INDUSTRIES BLDG TM KALAW ERMITA MLA ,,to 12/31/1982,DEVELOPMENT & TECHNOLOGY CONSULTANTS INC  Private Employment Agency,MR ANTONIO HUAB,Cancelled,,
"G/F, 206 & 301 LUZ HENSON BLDG. 1555 MABINI ST.  ERMITA, MANILA",None,4/17/2002 to 4/29/2004,DGLF INTERNATIONAL SERVICES Private Employment Agency,DOMINADOR B GAMBOL,Cancelled,4501245/ 4501253/ 3021154/5368737 (telefax),None
4F DHC BLDG 1115-1117 EDSA  QUEZON CITY,dhc_manila @yahoo.com,7/27/2003 to 7/26/2007,"DHC INTERNATIONAL RECRUITMENT AND CONSULTANCY, INC. Private Employment Agency",CESAR L CARAON,Cancelled,4100406/ 3734231,
6 LEONILA ST IRENEVILLE I SUCAT PARANAQUE MM ,,to 2/5/1988,DIADEM INTERNATIONAL MANPOWER SERVICES INC Private Employment Agency,MR ALEXANDER AQUINO,Forever Banned,8150417 / 873791,
"U-404,405,406,&903 (GF), SCANDIC PALACE,4291 EMILI PALANAN, MAKATI",dhmsai@yahoo.com,8/14/2016 to 8/13/2020,DIAMOND H MARINE SVCS.& SHIPPING AGENCY INC. (FORMERLY DIAMOND H Manning Agency,MR RUBEN J TURINGAN,Valid License,4034519/ 0917-5183550/ 0917-8350330,www.dhshipping.com
2157 RIZAL AVE COR BATANGAS ST STA CRUZ MANILA ,,to 7/22/1982,DIAMOND INTERNATIONAL (CLOVER INT`L)  Private Employment Agency,,Cancelled,,
2F #2 KAMUNING RD COR TOMAS MORATO AVE QUEZON CITY,diamondhec@skyinet.net,7/11/2015 to 7/10/2019,DIAMOND OVERSEAS MANPOWER ENTERPRISES (FOR: DIAMONDS INTL MANP SVCS) Private Employment Agency,A H SALVADOR CURAMENG,Valid License,4251017,None
"U-1&3 (GF),MF,2F & 3F, FELISA BLDG, 952 QUIRINO AV MALATE, MANILA",None,1/19/2011 to 1/18/2015,DIAMOND ROSE HUMAN RESOURCES AND SERVICES CORPORATION Service Contractor,,Cancelled,708-3693 (telefax),None
"2/F COMMODORE BLG.442 ARQUIZA ST,MANILA ",None,2/3/2000 to 2/1/2002,"DIMENSIONAL INTERNATIONAL RECRUITMENT AGENCY, INC. Private Employment Agency",,Delisted,310-3370/ 6523557,None
"RM 101- B, G/F, DOLMAR BUILDING, 56 EDSA MANDALUYONG",None,8/29/2014 to 8/28/2018,DIMENSION-ALL MANPOWER INC (FOR. SUPERSONIC MANPOWER SERVICES CORPORATION) Service Contractor,JOELLE ESTHER R GOUDSMIT,Valid License,310-0070,www.damanpower.com
BASEMENT & 2/F MLA MANOR HOTEL 1660 J.BOCOBO MALAT ,,1/18/1993 to 1/17/1995,DIMO ENTERPRISES & OVERSEAS PLACEMENT AGENCY Private Employment Agency,MR GREGORIO V DIZON,Delisted,573055 / 574716,
RM.301 GEMINI BLDG 215 G.PUYAT AVE MAKATI,,6/29/1988 to 6/29/1990,DISCOVERY PROMOTIONS INC  Service Contractor,MR JOLLY L TING,Delisted,851885 / 882806,
87-D TUAZON ST QUEZON CITY ,,to 2/11/1990,DISTINCTRADE OVERSEAS MANAGEMENT & CO  Private Employment Agency,MS JANET F ANAGARAN,Forever Banned,7410105 / 7119107,
2636-A & B A.BONIFACIO ST BANGKAL MAKATI CITY ,,12/21/2000 to 12/20/2002,DIVAS MANPOWER SERVICES (FORMERLY JASOM MANPOWER SERVICES Private Employment Agency,CARMELITA D DELA CRUZ,Delisted,8891262 / 8434164,
"2/F 1517 F AGONCILLO ST ERMITA MANILA ERMITA, MANILA",NA,10/27/2015 to 10/26/2019,DIVERSIFIED INTERNATIONAL SERVICES INC Manning Agency,RODOLFO D. ESTAMPADOR,Valid License,5212436,NA
"2F 1517 F AGONCILLO ST. ERMITA, MANILA",administrator@discinc-ph.com / info@disinc-ph.com,12/14/2015 to 10/26/2007,DIVERSIFIED INTERNATIONAL SERVICES INC Private Employment Agency,CAPT RODOLFO D ESTAMPADOR,Suspended,5229993,www.disinc-ph.com
RMS 302-305 JALANDONI BLDG 1444 A.MABINI ST MLA ,,6/24/1986 to 1/15/1995,DIVINE GRACE PLACEMENT INC (NARCICON INT`L PLACEMENT AGENCY) Private Employment Agency,MS LUZVIMINDA MANLAPIG,Delisted,571265 / 571670,
1035-C J.BOCOBO ST ERMITA MANILA ,,4/19/1990 to 4/17/1992,DJUVEL MANAGEMENT & CONSTRUCTION SERVICES INC Service Contractor,VIRGINIA L STO DOMINGO,Cancelled,8182844,
"GF,ALFA BLG, MH DEL PILAR COR CUARTELES STS ERMITA, MANILA",info@dlbmanpower.com,3/28/2016 to 3/27/2020,DLB INTERNATIONAL INC. Private Employment Agency,CHRISTOPHER E SAN JOSE,Valid License,2418404/2418403/2418471,www.dlbmanpower.com
"3F TANDEM BLDG PRES. QUIRINO AVE. MALATE, MANILA ",,9/15/1998 to 9/13/2000,DLJ PLACEMENT AND GENERAL SERVICES  Private Employment Agency,MS GILDA B NAGHMI,Delisted,3530918 / 8558695,
"DMCI ANNEX BLDG., 2278 DON CHINO ROCES AVE. MAKATI",dmci@dmcinet.com,2/28/2015 to 2/28/2017,DM CONSUNJI INC Construction Contractor,MR JORGE A CONSUNJI,Valid License,8410841/ 8883624/ 8883990,None
"23 AMALINGAN ST.,GREENHEIGHTS VILL.,SUCAT ",,3/8/2003 to 3/7/2007,DMJ INTERNATIONAL RESOURCES INC  Service Contractor,DOMINGO B. JANGAYO,Cancelled,826-0998,
"2/F VICTORIA I,1ST ST.SIMPLICIO CRUZ COMPD.,SUCAT ",,2/24/2004 to 2/23/2008,DMP INTERNATIONAL SERVICES INC  Service Contractor,MR BENJAMIN R PEREZ,Delisted,8269861 / 8269190,
"4F, G & A BLDG, 2303 DON CHINO ROCES AVE EXT MAKATI",edmundo.maxilom@dnroffshore.com,4/21/2017 to 4/20/2021,DNR OFFSHORE AND CREWING SERVICES INC Manning Agency,EDMUNDO T MAXILOM JR,Valid License,(02) 7721135 / 09174930199,www.dnroffshore.com
"STALL 1A, 8A&B AND 9A, 2F, ARQUIZA TRADE CTR, 1214 ERMITA, MANILA",dobim_recruitment@yahoo.com,2/17/2013 to 2/16/2017,DOBIM INTERNATIONAL MANPOWER SERVICES Private Employment Agency,OPHELIA D. WILLIAMS,Cancelled,484-2533 telefax / 379-9984,NA
"UNIT A-C G/F CASITA STA ROSA BDG BGY DILA SANTA ROSA CITY, LAGUNA",dohaenergyintl@yahoo.com,7/5/2015 to 7/4/2019,DOHA ENERGY INTERNATIONAL MANPOWER SERVICES CO Private Employment Agency,BRENDA F OGA,Valid License,(049) 5081362 / 09175496089/ 09399224110,NA
"2/F&3/F,DOHLE HAUS MANILA,30-38 SEN GIL PUYAT AVE SAN ISIDRO, MAKATI",seafrontdocumentation@doehle-seafront.com,3/21/2017 to 3/20/2021,DOHLE SEAFRONT CREWING (MANILA) INC (FORMERLY SEAFRONT CREWING (MANILA) INC Manning Agency,ATTY IRIS V BAGUILAT,Valid License,7058400,www.doehle-seafront.com
"U25 3F LGSPI TWR 300 #2600 RXS BLVD COR VITO CRUZ MALATE, MANILA",doing@live.com.ph,4/21/2016 to 4/20/2020,DOING MANPOWER INCORPORATED Service Contractor,JEFFREY G SOLOMON,Cancelled,(02) 3531082 / 3537395/ 09771910292/ 09175387603,None
"GF&2F,916 NAKPIL ST.COR.AGONCILLO ST.,MALATE,MLA. ",doka_mgs@yahoo.com & jra@qinet.net,5/27/2003 to 5/26/2007,"DOKA MANPOWER & GENERAL SERVICES, INC. Private Employment Agency",JOSE R. ABILA,Cancelled,4050164-65,None
"GF 2F R301 & 302, VGC BLDG., I #936 PEDRO GIL COR  MALATE, MANILA",dipc13@yahoo.com,2/2/2012 to 2/1/2016,DOLMA INTERNATIONAL PLACEMENT CORP. Service Contractor,TERESITA T CLAVERIA,Cancelled,4980890/4981228/ 0939-9452652,None
UNIT O MARISAN ARCADE 2943 DEL PILAR S`SUPER H-WAY ,,11/25/1993 to 11/24/1995,DOMA MANPOWER CENTER  Private Employment Agency,MS DOLORES O MAGAY,Delisted,8435205 / 885234,
"2/F (PORTION), VYNEX SIGNS PHILS. BLDG., LOT B, ST TAGUIG",operation@domecph.com,5/31/2015 to 5/30/2019,DOMINION OVERSEAS MANAGEMENT EURO-ASIA CORPORATION Service Contractor,EDGARDO H FAUSTINO,Valid License,8082021/8081442,www.domecph.com
"GROUND FLOOR NO 6350 GEN LUNA ST BANGKAL, MAKATI",None,8/28/2001 to 8/28/2003,DON-DON INTERNATIONAL PLACEMENT AGENCY Private Employment Agency,RAFAEL D SANTISTEBAN JR,Delisted,8894418,None
"1977-A1 A LINAO ST MALATE, MANILA",doublemarine@yahoo.com,2/17/2016 to 2/16/2020,DOUBLE M MARINE SERVICES INCORPORATED Manning Agency,JULIUS DELA CRUZ,Valid License,5227947/5264235/407-7620,NA
"BLK 3 LOT 3, TITUS ST FAIRVIEW, QUEZON CITY",NA,7/6/2004 to 7/6/2005,DOVER PLACEMENT AND SERVICES CORPORATION Private Employment Agency,PAUL AQUILIN V. CALDERON,Delisted,8333753/8316128,NA
"G/F 1A 1820 L. GUINTO ST. MALATE, MANILA ",,5/26/1999 to 5/24/2001,DO-WAY INTERNATIONAL MANPOWER SVCS. FOR. ARAFIL O`SEAS MANP. SVCS. Private Employment Agency,MS CARMELITA A SOLIS,Delisted,3035502 / 3600500,
62 TANGALI ST QUEZON CITY ,,1/19/1989 to 1/19/1991,DP FLORES CONSTRUCTION COMPANY INC  Construction Contractor,MR DIMASALANG P FLORES,Delisted,344086 / 356870,
8 YAKAN ST LA VISTA QUEZON CITY ,,8/10/1988 to 8/10/1992,DP MALLARI CONSTRUCTION  Construction Contractor,MR DEMETRIO P MALLARI,Delisted,974393 / 977530,
GF CONSUELO BLG 1365-E RODRIGUEZ SR AVE CUBAO QC ,None,6/8/2002 to 6/7/2006,DPC PLACEMENT & MANPOWER SERVICES INC Private Employment Agency,JOSEPHINE A. ENRIQUEZ,Delisted,7215276 to 77,None
3698-C BAUTISTA ST SAN ANTONIO VILL MAKATI ,,6/27/1986 to 1/29/1993,DR MONZON & COMPANY INC  Construction Contractor,MR DIOSDADO R MONZON,Cancelled,862382 / 862376,
"2640 DIAN ST MALATE, MANILA",mrktg_dimc@yahoo.com,11/24/2002 to 11/23/2006,DRAGON INTERNATIONAL MANPOWER CORP Private Employment Agency,MS. JULIET T PANAGUITON,Delisted,522-2398/484-8158/5252780,www.dragonmanpower.com
"G/F DON JOSE BLDG 533 A.FLORES CORNER GREY STS. ERMITA, MANILA",dragonluck@eastern.com.ph,11/30/2003 to 11/29/2007,DRAGON LUCK INTERNATIONAL PLACEMENT SERVICES Private Employment Agency,SUZZETTE G GONZALES,Cancelled,302-3040,None
RM.206 ICP BLDG 1081 P.GIL ST PACO MLA ,,3/7/1990 to 3/7/1992,DRC GENERAL SERVICES INC  Private Employment Agency,MR LUIS H OBRERO,Cancelled,507101 / 503341,
"S-409&411,4F, ERMITA CTR BLDG, 1350 ROXAS BLVD ERMITA, MANILA",d.builders@yahoo.com.ph,3/30/2015 to 3/30/2019,DREAM BUILDERS INTERNATIONAL MANPOWER CORPORATION Private Employment Agency,JACQUELINE PABALAN MORENO,Valid License,7330263,www.dreambuildersmanpower.com
"SUITE 803 (A&B) ERMITA CENTER BLDG. #1350 ROXAS BL ERMITA, MANILA",dreamfame2000@yahoo.com,7/27/2010 to 7/26/2014,"DREAM FAME INTERNATIONAL MANPOWER CORPORATION (FORMERLY IRISH PRODUCTION, I Service Contractor",MS SAHMI M BAUNTA,Cancelled,302-9038/302-9017,None
"G/F & 2/F, 1726 LEON GUINTO STREET MALATE, MANILA",weng.dfim@yahoo.com/dreamforce_international@y.c,4/1/2016 to 3/31/2020,DREAM FORCE INTERNATIONAL MANPOWER SERVICES INC Service Contractor,RAICEPH APUADA GAURANO,Valid License,3530504/3536590/ 0917-8282916 (mobile),None
"1555-A RAMONA APARTMENTS ERMITA, MANILA",NA,9/3/2007 to 9/3/2011,DREAMS MANPOWER AND RECRUITMENT AGENCY Private Employment Agency,FRANCISCO C. FERNANDEZ JR,Cancelled,536-1151,NA
RM.302-C 3/F TRADE CTR BLDG. P.FAURA ERMITA MLA ,,9/30/1996 to 9/29/1998,DREAMS RECRUITMENT GENERAL SERVICES  Private Employment Agency,AMELIA MARCELO,Delisted,5268751 / 5268003,
150-1 15TH AVE POTENTIAL TOWNHOUSE U27 MURPHY QUEZON CITY,dreamway_agency@yahoo.com.ph,1/27/2006 to 1/27/2010,DREAMWAY RECRUITMENT AGENCY Private Employment Agency,MERLYN A. HUANG,Cancelled,4389476/ 9128025,www.dreamway-ph.com
2F VALENZUELA BUILDING 263 REAL ST PAMPLONA TRES LAS PIÑAS,None,3/2/2016 to 12/1/2016,DREAMWORK CONSTRUCTION INC Construction Contractor,ROBERTO S CONCEPCION,Valid License,,None
RM 307 3F SISON MANSION 2631 ROCKEFELLER ST. MAKATI,None,1/30/2003 to 1/30/2004,DREAMWORKS INTERNATIONAL SERVICES CORPORTION Private Employment Agency,MR. PEDRO GUEVARRA,Delisted,8872209,None
2F COMMUNITY CHEST FOUND INC BLG 815 REMEDIOS ST ,None,11/23/2010 to 11/22/2014,DYNAMIC INTERNATIONAL SERVICES CORPORATION Private Employment Agency,RUEL B. BATISLA-ON,Cancelled,5267608,None
"136 SOUTH 3RD ST TANGUB CITY, MISAMIS OCCIDENTAL",None,9/4/2001 to 9/4/2003,DYRONS PLACEMENT AGENCY Private Employment Agency,LORELEI RHONA F CONOL,Delisted,0883953054,None
"G/F MEGASTAR REALTY ENTERPRISE CORP. BLDG., 190 MALATE, MANILA",NA,3/11/2008 to 3/10/2012,DYWEN INTERNATIONAL MANPOWER AGENCY Private Employment Agency,MA.CORAZON N.EVANGELISTA,Cancelled,524-7085,NA
RM.505 VIP BLDG. 1140 ROXAS BLVD. ERMITA MANILA ,,1/11/1999 to 1/10/2001,E & C INTERNATIONAL MANPOWER CO.  Private Employment Agency,MS ELVIRA N CORTEZ,Delisted,3383696 / 3022697,
"62-C MALAKAS STREET, BRGY. PINYAHAN QUEZON CITY",elkhuman2011@hotmail.com,12/7/2014 to 12/6/2018,"E.L.K. HUMAN RESOURCES, INC. Private Employment Agency",AIDA L SOSMENA,Valid License,(+632) 4333082,None
"G/F (RECEPTION AREA)& 12/F 1965 LEON GUINTO STREET MALATE, MANILA",ercpinfo@ercp.com.ph,7/27/2016 to 7/27/2020,E.R. CREW MANAGEMENT (PHILIPPINES) CORP Manning Agency,CAPT VICENTE A DAYO,Valid License,2432511 / 092091751550,www.erp.com.ph
"NO.2 ROSE AVE.PILAR VIL. LAS PI#AS, MM ",None,8/20/2000 to 8/19/2002,"E.Y. ORBESO CONSTRUCTION AND MANPO- WER SVCS.,INC.(FOR EX ORBESO) Private Employment Agency",EMILIO ORBESO JR,Delisted,8036033/ 8007761,None
"LOT 17 BLOCK 7 GREENPLAINS II SINGCANG BACOLOD CITY, NEGROS OCCIDENTAL",OPERATIONS@EAINRNATIONAL.NET,3/8/2008 to 3/7/2012,EA INT`L PLACEMENT & GENERAL SERVICES Service Contractor,MS ELSIE DELA CURA,Delisted,034--433-8971/453-3407,WWW.EAINTERNATIONAL.NET
2/F HEIDELBERG HOUSE 9584 KAMAGONG MAKATI CITY ,,to 11/17/1993,EAC SERVICES INC  Manning Agency,MR TORBEAN SODERLUND,Delisted,857751 / 8609262,
"5F & 6F, THE GREGORIAN BLG, 2178 TAFT AVE MALATE, MANILA",eagleclarc@eagleclarc.com/arcilla@eagleclarc.com,6/17/2017 to 6/16/2021,EAGLE CLARC SHIPPING PHILIPPINES INC Manning Agency,LEOPOLDO T ARCILLA SR,Valid License,525-2285/536-0755/ 09189713626,www.eagleclarc.com
"2/F PAROLA HOUSE 1582 COPERNICO ST MAKATI CITY SAN ISIDRO, MAKATI",rgs@eaglestar.com.ph,12/13/2016 to 12/12/2020,EAGLE STAR CREW MANAGEMENT CORPORATION Manning Agency,ROSELLA G. SANTILLAN,Valid License,7395600/ 09178711298,www.eaglestar.com.ph
"S303 &307 SISON MANSION 2631 ROCKEFELLER BATANGAS SAN ISIDRO, MAKATI",eakintrecruitment@gmail.com,3/4/2017 to 9/3/2017,EAK INT`L RECRUITMENT SERVICES CO Private Employment Agency,EMMA A KENG,Valid License,8327027/ 09292013933/ 09062700784,None
RM.502 & 503 JALANDONI BLDG 1444 A.MABINI ERMITA ,,6/28/1992 to 6/27/1994,EAP INTERNATIONAL INC  Private Employment Agency,,Delisted,5268977 / 5268980,
U421-424BLG M ONE OASIS ORTIGAS AVE BGY STA LUCIA PASIG CITY,info@earthsmart-phil.com,2/27/2017 to 2/27/2019,EARTHSMART HUMAN RESOURCE PHILIPPINES INC Private Employment Agency,LLOYD DEXTER L CARVAJAL,Valid License,(02) 4779070 / 09273035354,NA
3F R308 JOVAN CONDO SAMAT ST MANDALUYONG,None,6/24/2005 to 6/24/2006,EAST ARC MARINE SERVICES INC (FORMERLY PACMAN MARINESERVICES INC) Manning Agency,JOSEFINA C. MAGLASANG,Delisted,5340876,None
GARCIA BLDG 636 RIZAL AVENUE STA CRUZ MANILA ,,to 8/29/1984,EAST ASIAN MARITIME ENTERPRISES  Manning Agency,MR VIRGILIO D SALAZAR,Delisted,507237 / 477720,
"R306 3F GSO BLDG M L QUEZON AVENUE HIGHWAY PAJO LAPU-LAPU CITY (OPON), CEBU",None,9/19/2013 to 9/19/2014,EAST MERIDIAN INTERNATIONAL MANPOWER AGENCY INC Private Employment Agency,MS MA CECILIA C JUNTILLA,Delisted,5205534,None
"2/F, ONE OLYMPIC BLDG, 8402 TRABAJO ST COR J.P. RI MAKATI",info@easttransglobalmci.com,2/6/2017 to 2/5/2021,EAST TRANSGLOBAL MANPOWER CONSULTANTS INC Private Employment Agency,NANNETT M. BASUEL,Valid License,5262356/ 5267214 / 09188111116,www.easttransglobalmci.com
STATE FINANCING CENTER BLDG ORTIGAS AVE MANDALUYONG,None,11/13/1983 to 7/30/1988,EAST WEST MANPOWER SPECIALIST Private Employment Agency,MR EMMANUEL T PINEDA,Cancelled,866911 / 86614,None
"G/F,2F,3/F(RIGHT WING) & 4/F, RIZZ TOWER, 1059 MET SAN ANTONIO VILLAGE, MAKATI",eastwest@eastwest.com.ph,1/3/2015 to 1/2/2019,EAST WEST PLACEMENT CENTER INC Private Employment Agency,RIZALINE O. DORMIENDO,Valid License,8956911,www.eastwest.com.ph
497 E.RODRIGUEZ SR. AVE. QUEZON CITY ,None,2/2/1998 to 2/1/2000,EASTERN CONSTRUCTION COMPANY INC (ECCOI) Service Contractor,MR MAGIN F SAN JUAN,Cancelled,7437391 / 7311175,None
497 E.RODRIGUEZ SR. AVE. QUEZON CITY ,None,8/30/1983 to 10/11/1992,EASTERN CONSTRUCTION COMPANY INC (ECCOI) Construction Contractor,MR MAGIN F SAN JUAN,Delisted,7437391 / 7311175,None
S 33-A ZETA BLDG 191 SALCEDO LEGASPI VILL MAKATI ,,9/24/1989 to 9/24/1990,EASTERN FISHERY & DEVELOPMENT CO  Philippine Registered Vessel,MR OSCAR F FADRI,Delisted,866241 / 866330,
12 DON PEPE STREET STO DOMINGO Q C ,,10/23/1989 to 10/23/1991,EASTERN HORIZON MARITIME SERVICES INC  Manning Agency,MR ROMUALDO CASAPAO,Delisted,,
"U 1, 2, 3, & 4, 888 GATEWAY PLAZA 2126 A MABINI ST ERMITA, MANILA",crewmanning@eastmed.mnl,4/16/2017 to 4/15/2021,EASTERN MEDITERRANEAN MANNING AGENCY INC (FORMERLY AGEMAR MANNING AGENCY ) Manning Agency,GREGORIO F. ORTEGA,Valid License,5235965,None
"R103 (RW) TRINITY BLDG, 636 TM KALAW ST ERMITA, MANILA",eastocean@eomcph.com,7/4/2017 to 7/3/2021,EASTERN OCEAN MARITIME CORPORATION Manning Agency,ELIZER A ODULIO,Valid License,4009402 / 4009409 / 5216025 / 09202596596,N/A
"GF & 2F, 1736-D, DIAN STREET PALANAN, MAKATI",easternemployment@hotmail.com,5/10/2016 to 5/9/2020,EASTERN OVERSEAS EMPLOYMENT CENTER INC Private Employment Agency,ASMA W AHMED,Valid License,834-8340/ 834-8339,None
RM.203-204 G.TERRACE ROXAS BLVD MANILA ,,2/17/2000 to 2/15/2002,EASTERN RESOURCES AND MARINE CORPORATION  Service Contractor,MR PORFIRIO M FLORES,Delisted,5260521 / 5260315,
"EASTERN SHIPPING LINES BUILDING ANDA CIRCLE PORT AREA, MANILA",None,8/15/2017 to 8/15/2021,EASTERN SHIPPING LINES INC Philippine Registered Vessel,MR ERWIN L CHIONGBIAN,Valid License,401081,None
"RM 311, 3F, LDM BLDG, M J CUENCO AVE COR LEGASPI S CEBU CITY, CEBU",manning@easternstarline.com.ph,2/23/2017 to 2/23/2019,EASTERNSTAR LINE INC Manning Agency,ALBERTO T MALAGA,Valid License,(032) 415-5233,None
"R301 3F 1928 LEON GUINTO ST MALATE, MANILA",eastgate.manpower@yahoo.com,4/21/2016 to 4/20/2020,EASTGATE MANPOWER CONSULTANTS INC (FORMERLY EFP MANPOWER CONSULTANTS) Private Employment Agency,ANDREW B CAGANG,Valid License,554-1141 / 554-1150/ 09183321102,None
"M101& PORTIONS GF,2F&3F, EASTGATE CTR,169 EDSA MANDALUYONG",emc@eastgategroup.com.ph,3/3/2017 to 3/2/2021,"EASTGATE MARITIME CORP.(FORMERLY EASTGATE(INTL)MARITIME AGENCIES,INC Manning Agency",MR EMMANUEL L REGIO,Valid License,5336101 /,www.manningships.biz
"RMS 202 & 204, MRS BLDG, 1431 A. MABINI STREET ERMITA, MANILA",eastside.international@yahoo.com,9/26/2016 to 9/25/2020,EASTSIDE INTERNATIONAL MANPOWER INC Private Employment Agency,CRISPINIANO R LAMORENA JR,Valid License,247-3488/ 0909-9894090 (mobile),None
"UNIT 307, 3RD FLOOR TAFT, EXCHANGE MALL PASAY CITY",NA,2/1/2005 to 2/1/2009,EASTWIND INTERNATIONAL PLACEMENT CORP. Private Employment Agency,RODRIGO J. CRUCILLO,Cancelled,5520247,NA
CHUA BLDG MCARTHUR DRIVE JARO ILOILO CITY ,,8/26/1998 to 8/26/2000,EASY LINES MANPOWER CORPORATION  Private Employment Agency,JULIANITO J GUMAPAS,Delisted,3296505,
"S605&609 (6F) & S507 (5F), AP BLDG 1563 F AGONCIL ERMITA, MANILA",easywayinternational_123@yahoo.com,5/24/2013 to 5/24/2017,EASYWAY INTERNATIONAL RECRUITMENT AGENCY CO Private Employment Agency,AMADOR C PINEDA JR,Cancelled,255-4890,None
"RM 39 & STE 1 MIDLAND PLAZA COND M ADRIATICO ST ERMITA, MANILA",EBL_INTERNATIONAL@YAHOO.COM/EBL32005@HAOO.COM,4/18/2004 to 4/17/2008,"EBL INTERNATIONAL MANPOWER SERVICES, INC Private Employment Agency",RODRIGO C. COLLADO,Cancelled,3033649,None
"MF MILESTONE HOTEL,834 BANAWE COR STA.CATALINA QC ",,8/23/2000 to 8/22/2002,EC GOZUM & COMPANY INC  Construction Contractor,MR EMILIO C GOZUM,Delisted,7495709 / 4101397,
OLD SKYFRIEGHT BLDG IMELDA AVE PARANAQUE ,,to 12/17/1987,ECA INT`L PLACEMENT & GEN MAINTENANCE SERVICES Private Employment Agency,MR CANDELARIO A ALMEDA,Forever Banned,8317534,
1143 PEREZ ST PACO MANILA ,,to,ED M SISON INC  Construction Contractor,MR EDUARDO M SISON,Cancelled,,
"3&4FLR MAGDALENA PAWNSHOP BLG 8127 P BURGOS GUADALUPE NUEVO, MAKATI",bon.efbgroup@gmail.com,4/23/2016 to 4/22/2020,ED-FRO-BON MANPOWER SERVICES Private Employment Agency,EDUARDO M FROGOSO,Valid License,751-3829 / 750-0752,None
"UNITS 701,703 & 704 CORPORATE CENTER 139 VALERO S SALCEDO VILLAGE, MAKATI",tag@edistaffbuilders.com,6/21/2014 to 6/20/2026,EDI STAFFBUILDERS INTERNATIONAL INC Private Employment Agency,"MR. CESAR A. AVERIA, JR.",Valid License,8126703 - 04/8921814,www.edistaffbuilders.com
ESGUERRA BLDG 140 AMORSOLO ST LEGASPI VILL MAKATI ,,to 11/19/1987,EDSA CONTRACTING CORPORATION (FORMERLY SP DACER CONSTRUCTION CO) Construction Contractor,MR FRANCISCO P BARAQUIEL,Forever Banned,586801 / 597941,
813 REINA REGENTE ST BINONDO MANILA ,,1/4/1996 to 7/4/1996,EDSA INTERNATIONAL SERVICES CORPORATION  Private Employment Agency,MR JOSEPH C. DYHENGCO,Delisted,2000434 / 2606341,
1828 SAN MARCELINO ST MALATE MANILA ,,to 5/22/1986,EDSIE INTERNATIONAL MANPOWER SERVICES  Private Employment Agency,MR EDUARDO G FRANCISCO,Forever Banned,595172,
"NO.53 PASEO DE ROXAS URDANETA VILLAGE, MAKATI",None,8/29/2000 to 8/28/2002,EE BLACK LTD Service Contractor,SAMSON L CASTANEDA,Denied Renewal,8410480 / 8128173/ 8128166,None
12 MANGGAHAN ST BAGUMBAYAN QUEZON CITY,eeicenter@eei.com.ph,11/9/2011 to 11/8/2023,EEI CORPORATION (FORMER ENGINEERING EQUIPMENT INC.) Construction Contractor,ROBERTO JOSE L CASTILLO,Valid License,(632) 6350843/ 6350851/ 09178234082,www.eei.com.ph
P2 B49 L24 BONIFACIO ST UPPER BICUTAN TAGUIG ,,3/10/1993 to 3/10/1995,EER EMPLOYMENT AGENCY  Service Contractor,MS ELIZABETH A RAMOS,Delisted,8127029 / 7195137,
"G/F KYMATA BLDG, 2740 FARADAY STREET SAN ISIDRO, MAKATI",NA,2/12/2015 to 2/11/2019,EFFICIENT INTERNATIONAL MANPOWER SERVICES INC Private Employment Agency,TEODORA P YODA,Cancelled,8874958/7205920,None
RMS 310 & 406 L&S BLDG ROXAS BLVD ERMITA MANILA ,,2/7/1994 to 2/7/1996,EF-MAR INTERNATIONAL INC  Service Contractor,EFREN S MARONILLA,Delisted,,
"530-A SAN RAFAEL STREET, BRGY. PLAINVIEW MANDALUYONG",efuplacementinc@yahoo.com,7/6/2011 to 7/5/2015,EFU PLACEMENT INC (FORMERLY EFU PLACEMENT) Private Employment Agency,EMELINDA F UY,Suspended,6544496,None
"4528 CASINO ST., BRGY PALANAN MAKATI CITY ",None,4/20/2002 to 4/19/2006,EGC MANPOWER SERVICES INC Service Contractor,EDUARDO G. CRUZ,Cancelled,5501322 telefax,None
"803 A, B & C, MALVAR STREET MALATE, MANILA",admin@egmpjobs.com,9/24/2015 to 9/23/2019,E-GMP INTERNATIONAL CORPORATION Private Employment Agency,ALEXANDER K TAN,Valid License,5231893/5237138 / 09209677318,www.egmpjobs.com
2976 3F PNB BLDG MEXICO AVE PASAY CITY ,,5/29/1996 to 5/28/1998,EIGHT SEASONS RECRUITMENT AND PLACEMENT AGENCY INC. Private Employment Agency,MR. PIERINO B. RATIGLIA,Delisted,,
2ND AND 3RD FLOORS 243 M SUAREZ AVENUE SAN MIGUEL PASIG CITY,legal@ejm.ph,5/22/2015 to 5/22/2019,EJM GLOBAL MANPOWER CORPORATION Private Employment Agency,JONAVIE B VIRAY,Valid License,6425127 / 09176237524,None
SUITE 106-214 BF COND ADUANA SOLANA INTRAMUROS ,,to 12/10/1985,EKISTICS PHILIPPINES INC  Construction Contractor,MR ALBERTO AGUIRRE,Cancelled,474873,
1398 GEN.LUNA ST COR APACIBLE ST PACO MANILA ,,3/8/1996 to 3/7/1998,EL BARY MANPOWER SERVICES  Service Contractor,MIRIAM M ABDUL BARY,Delisted,582373 / 595372,
2F & 3F ARVENT BLDG GEN.LUNA ST ERMITA MANILA ,,7/19/1994 to 7/18/1998,EL GRANDE SHIPPING AGENCY CORPORATION  Manning Agency,MR RODOLFO E VENTURANZA,Delisted,5216105 / 589234,
70 BOHOL AVENUE QUEZON CITY ,,to 5/14/1986,EL GRECO INTERNATIONAL PHILIPPINE MANPOWER PLACEMENT WORLDWIDE Private Employment Agency,MS LILLIAN M TOUNDJIS,Delisted,977051 / 977053,
70 SGT E A ESGUERRA AVE. QUEZON CITY ,None,10/18/2007 to 10/17/2011,EL GRECO SHIP MANNING & MGT. CORP. (EL GRECO SHIPPING ENTERPRISES) Manning Agency,PETER N TOUNDJIS,Delisted,9297051 TO 53,None
5127 FILMORE COR BOYLE STS MAKATI,None,1/11/2001 to 1/10/2003,"EL-ADAM INTERNATIONAL AGENCY CO.,LTD. Private Employment Agency",MR ELMER C BALIBAY,Delisted,5501502/ 5501440,None
"3F & 4F, HALA BLG 1836 LEON GUINTO ST MALATE, MANILA",Elizabeth.elbeitam@yahoo.com,4/28/2015 to 4/27/2019,"ELBEITAM MANAGEMENT SERVICES, INC. Private Employment Agency",ELIZABETH C CASANOVA,Cancelled,5227286/5241196/ 0999-9931499,www.elbeitamagency.com
"16/F & 17/F, PHIL. AXA LIFE CENTRE COND CORP, 1286 MAKATI",elburg@elburgshipmanagement.com.ph,4/7/2017 to 4/6/2021,ELBURG SHIPMANAGEMENT PHILS INC (FORMERLY RICA INTL MANNING AGENCY IN Manning Agency,RICHARD P PALPAL-LATOC,Valid License,8170971 TO 75/8942711,www.elburgshipmanagement.com
"G-4 BEL-AIR APARTMENTS BLDG1020 ROXAS BLVD ERMITA, MANILA",None,8/7/2001 to 8/3/2003,ELCCIJ MARINE SERVICES Manning Agency,LETICIA C SAGAIDORO,Suspended,5227552/ 5227553,None
202 E.RODRIGUEZ SR BLVD QUEZON CITY ,,to,ELCO DEVELOPMENT & CONSTRUCTION CORPORATION Construction Contractor,MR FLORELLO R ESTUAR,Inactive,785991 / 785994,
2161-A TAFT AVE MALATE MANILA ,,12/27/1993 to 12/28/1995,ELEA MANPOWER CORPORATION  Private Employment Agency,MR DOMINGO G ESTRADA JR,Delisted,587486 / 509529,
8334-B DR A SANTOS AVE SUCAT PARA#AQUE ,,to,ELECTROEN INC  Construction Contractor,MR DANILO ROY,Inactive,,
"ROOMS 308 & 316 GEDISCO CENTRE 1564 A MABINI ST ERMITA, MANILA",eleutheria2016@yahoo.com,9/6/2017 to 9/6/2019,ELEUTHERIA INTERNATIONAL PLACEMENT SERVICES INC Private Employment Agency,SALLY G CANLAS,Valid License,(02) 4501052 / 09258205073/ 09434163662,N/A
1856 F AGONCILLO STREET MALATE MANILA,elevomanpower2016@gmail.com,9/28/2017 to 9/28/2019,ELEVO MANPOWER SERVICES CORP Private Employment Agency,EULOGIO A CONDES JR,Valid License,5622576/ 09987296824,www.elevomanpowerservicescorp.com
RM 301 GLC BLDG TM KALAW/A MABINI ERMITA MLA ,None,2/15/2003 to 2/14/2007,ELF INTERNATIONAL MANPOWER SERVICES Private Employment Agency,FLOCERFINA T. MOLINA,Cancelled,3389295 / 3389296,None
"724 I & K 726 J 3F TANDEM BLDG QUIRINO AVE MALATE, MANILA",None,2/12/2002 to 2/12/2004,ELI INTERNATIONAL MANPOWER SPECIALIST Private Employment Agency,EMMANUEL E ZAPANTA,Cancelled,5236410 / 3031077,None
