Address,Email Address,License Validity,Name,Official Representative,Status,Tel No/s,Website
"RM.405 ERMITA BLG.,ARQUIZA COR. ALHAMBRA STS. ERMITA, MANILA",NA,9/19/2006 to 9/19/2007,JOBTRADE INTERNATIONAL MANPOWER SERVICES Private Employment Agency,VIRGINIA L. SANCHEZ,Cancelled,5257120 telefax,NA
16 IRID ST CUBAO QUEZON CITY ,licor_prom@yahoo.com,11/14/2003 to 11/13/2007,JOE`S INTERNATIONAL CORPORATION  Service Contractor,MS JOSEFINA NORCIO,Delisted,7233403 / 7233404,
"UNITS 1 & 2 (2ND LEVEL), THE RAFAEL YU BLDG, 77 GE CEBU",johnmauriceinternational@yahoo.com,8/23/2014 to 8/22/2018,JOHN MAURICE INTERNATIONAL INC Service Contractor,EMELYN D RODULFA,Valid License,(032) 2361925/2544873/5213388/5217234/5214904,None
"S-1 & 2, 1036-1038 J. NAKPIL  MALATE, MANILA",None,5/1/2002 to 4/30/2004,JOIN INTERNATIONAL CORP Private Employment Agency,ELIZABETH T ALAÑON,Cancelled,5240020/19,None
3F DMC BLDG. 310 EDANG ST. PASAY CITY ,,12/5/2000 to 11/27/2002,"JOMA JOB OVERSEAS MANPOWER AGENCY, INC.  Private Employment Agency",JOEL DAYRIT,Delisted,8533840 / 3604100,
"SUITE 604 JALANDONI BLDG 1444 A.MABINI ST ERMITA, MANILA",,1/1/1950 to 7/25/1986,JOMO MARITIME MANAGEMENT INC  Manning Agency,MR RENIE M MODELO,Forever Banned,,
"U1 & U2 (GF), F.BENITEZ TOWN HOMES 1695 F.BENITEZ  MALATE, MANILA",jones_intl@pldtdsl.net,2/10/2015 to 2/9/2019,JONES INT`L MANP. SVCS. INC.(FOR. JONES SPCL MNGT TRDG & MANP SVCS) Private Employment Agency,MR EDWARD G CUE,Valid License,5225156 /5227006/5253219,None
"3F & 4F, THRIFTY REALTY BLG, 1927 SAN MARCELINO ST MALATE, MANILA",jopmancorp@yahoo.com,1/8/2015 to 1/7/2019,JOPMAN CORPORATION (FOR EXPLICIT CORP) Private Employment Agency,MARIA CARMENCITA N CUVIN,Valid License,5254661 OR 62 /5254666/ 0920-9582016,None
5/F L & S BLDG 1500 ROXAS BLVD ERMITA MANILA ,,7/3/1996 to 6/22/1998,JOSCAR SHIPPING COMPANY INC  Philippine Registered Vessel,MR VICTORINO A BASCO,Expired,,
"G/F & 2/F, MI TESORO FAMILIA BLG, 4334 GEN. TINIO  BANGKAL, MAKATI",joselineintl@gmail.com/ joseline@jimc.asia,8/7/2014 to 8/6/2018,JOSELINE INTERNATIONAL MANPOWER CORPORATION (FORMERLY PARAS ENTERPRISES) Private Employment Agency,,Valid License,4581067,www.joselineintlmanpower.com.ph
"RM 202, KBC BLG, 353 J.P. RIZAL ST, BGY OLYMPIA MAKATI",jovialagency@gmail.com,12/29/2007 to 12/28/2011,JOVIAL PROMOTION & PLACEMENT AGENCY Private Employment Agency,JUDE S. JUNSAY,Cancelled,3924556,None
"4443 CALATAGAN ST.,PALANAN MAKATI CITY ",None,4/8/2002 to 9/4/2003,JOVIC INTERNATIONAL PROMOTION Private Employment Agency,VICENTE T BANZUELA,Delisted,8333856 / 7285722,None
"SUITE 602, BEL-AIR APT 1020 ROXAS BLVD ERMITA, MANILA",jims_manpower@yahoo.com,11/17/2011 to 11/16/2015,JOVINERIA INTERNATIONAL MANPOWER SERVICES Private Employment Agency,JOSEPHINE R. SALAZAR,Cancelled,5241465/4845851,NA
3161 V.MAPA ST STA.MESA MANILA ,,6/2/1996 to 6/1/1998,JP LUNA INTERNATIONAL BUSINESS VENTURE  Private Employment Agency,MR JUAN P LUNA,Delisted,7138320,
"1977 A.LINAO STREET MALATE, MANILA",admin@jphilmarine.com,11/28/2016 to 11/27/2020,"J-PHIL MARINE, INCORPORATED Manning Agency",EULALIO C. CANDAVA,Valid License,5227947/ 3030179-81,None
"ROOM 305 GEDISCO TERRACE 1148 ROXAS BOULEVARD ERMITA, MANILA",info.jpm88@gmail.com,10/5/2017 to 10/5/2019,JPM88 INTERNATIONAL MANPOWER SERVICES CO Private Employment Agency,LJUBOMIR C TAMAYO,Valid License,(02) 5855961 / 09955119618 / 09086380938,jpm88manpower.com
"UA2 & F,GF,ECHELON TOWER, 2100 A. MABINI ST MALATE, MANILA",jpsrotana@yahoo.com,8/11/2014 to 8/10/2018,JPS (JOHN PAUL SEE) INTERNATIONAL RECRUITMENT AGENCY CORP Private Employment Agency,DANIEL I. CUEVAS,Cancelled,7947892/ 7947891 / 09975248184,www.jpsrecruitment.com.ph
"S-101,302,306 RAMON LIWAG BLDG 1258 BATANGAS ST MK ",,11/6/1991 to 11/6/1995,JR MANPOWER AND DEVELOPMENT SERVICES COMPANY Service Contractor,MR RENATO B PARAS,Delisted,852373 / 851874,
2F RMS 9-10 RENADAR BLDG 1360 L.GUINTO ERMITA MLA. ,,3/12/1996 to 9/11/1996,JRP MANPOWER SERVICES  Private Employment Agency,JANET PARRENO,Delisted,,
RM.303-305 TRADE CTR BLDG P.FAURA ERMITA MLA ,,9/14/1994 to 3/14/1995,JRS PLACEMENT SERVICES INC  Private Employment Agency,MR EDROLEEN P SANTOS,Delisted,5210459 / 5210461,
"2646-H TAFT AVE MALATE, MANILA",info@jrtmagica.com/jrtmagica_intl@hotmail.com,5/7/2015 to 5/6/2019,JRT MAGICA INTERNATIONAL PLACEMENT AND GENERAL SERVICES CORPORATION Private Employment Agency,MA. CONCEPCION T. CODOG,Valid License,5260031/ 5232023/ 09228375309/ 09088144112,www.jrtmagica.com
"GF&2F JS CON BLG,423 MAGALLANES & BEATERIO, INTRA INTRAMUROS, MANILA",jsrecruitment@jscon.com.ph,3/8/2016 to 3/7/2020,JS CONTRACTOR INCORPORATED Construction Contractor,MS MARY JEAN BORRA,Valid License,5277955 TO 57 / 5277958 to 59 / 09188038534,www.jscon.com.ph
"2F, 3F & 4/F, IBAÑEZ BLDG, 962-968 PRES QUIRINO AV MALATE, MANILA",jscglobalrecruitment@gmail.com,3/6/2014 to 3/6/2018,JSC GLOBAL RECRUITMENT SERVICES INC. Private Employment Agency,JAIME S. CINCO,Valid License,2473126/3104519/ 3109917/ 09178871439/ 09998838179,NA
"GF&2F DON JOSE BLDG 533 A FLORES ST ERMITA, MANILA",None,10/17/2003 to 10/16/2007,JSD INTERNATIONAL EMPLOYMENT AGENCY CORPORATION Private Employment Agency,ROSALINDA S DAVID,Cancelled,5214250 / 4006602,None
"GF & 2F, 2011 A. MABINI STREET MALATE, MANILA",jslinterplacementservices@yahoo.com,5/1/2015 to 4/30/2019,JSL INTERPLACEMENT SERVICES Private Employment Agency,JULIO M SALAZAR,Valid License,891-6576/251-4420/ 09399307044,www.jslinterplacement.com
"S603 6F PARC HOUSE II CONDO 21 EDSA GUADALUPE NUEVO, MAKATI",None,5/28/2002 to 5/27/2004,JSM INTERNATIONAL MANPOWER GROUP INC Private Employment Agency,JUN S MANGUNDAYAO,Delisted,8817864,None
1786-E TAFT AVE PASAY CITY ,,12/6/1996 to 12/5/1998,JSS INDOCHINA CORPORATION (WE CARE PERSONNEL SVCS CORP ) Private Employment Agency,PABLO R DY JR,Delisted,5124636 / 866919,
1989 LEON GUINTO ST MALATE MANILA ,,to 8/24/1986,JT SKILLED LABOR CENTER  Private Employment Agency,MR JOSE T TAPANG,Forever Banned,594638 / 571683,
"RMS 603 & 708, DOÑA FELISA SYJUCO BLDG, 1872 REMED MALATE, MANILA",admin@jtcmanpower.com,2/1/2016 to 1/31/2020,"JTC INTERNATIONAL MANPOWER SERVICES, INC Private Employment Agency",CATHERINE A VERGARA,Valid License,5541356/ 5541437/ 5541404,jtcmanpower.com
SUITE 5 MIDLAND PLAZA HOTEL M.ADRIATICO ERMITA ,,to 10/9/1985,JTK MANPOWER EXPERTS  Private Employment Agency,MR VIRGILIO KAWACHI,Cancelled,8313517,
"5F, 1377 A MABINI STREET CORNER STA MONICA ERMITA, MANILA",juansmartworkers@gmail.com,11/22/2016 to 11/22/2018,JUAN SMART MANPOWER PHILS CO Private Employment Agency,AMELITA E NUGUID,Valid License,3106232 / 09276677468,None
27 ASTER ST WEST FAIRVIEW QUEZON CITY ,,to 10/26/1985,JUNCARLO INTERNATIONAL SERVICES  Service Contractor,MS GUAT LEE N GANAN,Cancelled,900182,
S-602 L & S BLDG 1414 ROXAS BLVD MANILA ,,4/19/1998 to 4/18/2000,JUNIPER SHIPPING COMPANY INC  Philippine Registered Vessel,MS ANGELITA T RIVERA,Inactive,5219744 / 5219567,
1049 METROPOLITAN AVE MAKATI METRO MANILA ,,to 4/26/1984,JUPITER CONSTRUCTION CORPORATION  Construction Contractor,MRS AMALIA IKDAL,Inactive,859258 / 859314,
* NO. 18 MONTCLAIR ST. MERVILLE PARK SUBD. PQUE ,,3/25/2002 to 3/23/2004,JUPITER MARITIME CORP  Manning Agency,CAPT AMADO V ROMILLO,Delisted,5273642 / 5273637,
G/F MARBELLA II BLDG 2071 ROXAS BLVD MANILA ,,7/14/1992 to 7/13/1994,JURONG ENGINEERING PHILS INC  Service Contractor,MR RAYMOND J GARCIA,Delisted,5217311 / 5217312,
"706 FEDMAN BLDG SALCEDO ST LEGASPI VILLAGE, MAKATI",JUSERR@BROLINE.COM,9/29/2003 to 9/28/2007,JUSERR INTERNATIONAL MANPOWER SERVICES Private Employment Agency,REYNALDO M SAN PEDRO,Cancelled,8924028/ 8924049,WWW.JUSERR.4T.COM
"NO. 8A AGNO STREET, STA. MESA HEIGHTS QUEZON CITY",justjobinternationalcorp@gmail.com,4/17/2012 to 4/16/2016,JUSTJOB INTERNATIONAL CORP (FORMERLY: ORACLE MANPOWER AGENCY) Private Employment Agency,HORACIO D. LIM,Cancelled,749-5266/743-7718/ 516-3894,None
2F & 3F GOTHARD BLDG 2127 MABINI ST MALATE MLA ,,10/26/1988 to 10/26/1990,JVD PLACEMENT AGENCY  Private Employment Agency,JOSEFINA V VERGEL DE DIOS,Cancelled,571352,
"301-304&401-404 LETICIA BLG,1804 TAFT COR NAKPIL MALATE, MANILA",jvrplacement@gmail.com/annequiza2@gmail.com,6/24/2015 to 6/23/2019,"JVR PLACEMENT COMPANY, INC. Service Contractor",ANNELYN M QUIZA,Valid License,310-0095,www.jvrplacement.net
2/F ANSON ARCADE PASAY ROAD MAKATI METRO MANILA ,,to 6/4/1983,JY SIBUG CONSTRUCTION  Construction Contractor,ENGR JOSE Y SIBUG,Cancelled,892627,
GERRY SO BLDG 8203 DR A SANTOS AVE BRGY SAN ISIDRO PARAÑAQUE,None,1/18/2018 to 1/18/2020,JZPT GLOBAL MANPOWER SERVICES Private Employment Agency,JONATHAN P TACAD,Valid License,,None
5/F ML BLDG 47 KAMIAS ST QC ,,to 5/30/1986,K & S INTERNATIONAL SERVICES  Private Employment Agency,MS ANITA F AMAGMA,Forever Banned,5217057,
"U 2&3 A FRANCISCO GOLD COND I 784 EDSA KAMIAS, QUEZON CITY",None,4/14/2008 to 10/13/2008,K AND S RECRUITMENT/PLACEMENT AGENCY Private Employment Agency,LUIS G CENDANA,Cancelled,4337983,None
"S 409 & 411, 4F, ERMITA CTR BLG, 1350 ROXAS BLVD ERMITA, MANILA",KGNPINT@HOTMAIL.COM,7/5/2011 to 7/4/2015,"K G & P INTERNATIONAL SERVICES, INC. Private Employment Agency",MR DIONISIO A TIZON,Cancelled,3536022 (TELEFAX),None
1042 SAN MARCELINO ST ERMITA MANILA ,,to 5/21/1988,K L SHIPPING AGENCIES INC  Manning Agency,MS TARCIANA H SANTOS,Delisted,571938,
KM.7 MIRAMAR HOUSE DOMESTIC ROAD PASAY CITY ,,6/11/1980 to 10/15/1992,K SERVICES COMPANY  Private Employment Agency,MR HERNANDO G IMPERIAL,Delisted,8312081 / 8312647,
U-301 RAMAN CONDO 1130 P.TAMO MAKATI CITY ,,7/7/1994 to 7/7/1996,K.G.W. INTERNATIONAL AGENCY INC.  Private Employment Agency,MS AMELITA O GAGAN,Delisted,8945781 / 8945731,
"GF & 2F ZL BDG, 834 E, ZOBEL COR. J.P. RIZAL STS MAKATI",kvinternational2003@yahoo.com,2/8/2007 to 2/7/2011,K.V. INTERNATIONAL MANPOWER SERVICES INC Private Employment Agency,ALICE U VILLAMOR,Delisted,8704900/7582940,None
280-A UNIT 1 EL GRANDE AVE BF HOMES PARAÑAQUE,JOSEPHUS_MACADAMIA@YAHOO.COM,6/19/2012 to 6/18/2016,KABAYAN KO OVERSEAS MANPOWER PLACEMENT Private Employment Agency,JOSEPHUS M. MACADAMIA,Cancelled,8204879,NA
"DELGADO BLDG BONIFACIO DRIVE PORT AREA, MANILA",,1/1/1950 to 1/1/1984,KAGITINGAN SHIPPING CORPORATION  Philippine Registered Vessel,MR CESAR P CARANDANG,Delisted,478541 / 478546,
"2ND FLOOR SHUDON BUILDING SAAC I BUAYA LAPU-LAPU CITY (OPON), CEBU",None,12/15/2016 to 12/15/2018,KAI KONNECTIONS INTERNATIONAL MANPOWER SERVICES INC Private Employment Agency,JUVY G IKEUCHI,Valid License,3415301,None
"U3,4&6 RUBLON BUS. CTR ORTIGAS AVE EXT CAINTA RIZA ",,7/8/2003 to 7/7/2007,KAIZEN ADMINISTRATIVE AND MANPOWER SERVICES INC. Private Employment Agency,MR CRISLETON R ESCONDO,Cancelled,6553126 / 6569045,
NO.1 ANNEX ABLAZA BLDG 117 E.RODRIGUEZ AVE QUEZON CITY,,10/5/1994 to 10/4/1996,KALANTAR PHILIPPINES  Private Employment Agency,MS VICTORIA L ALCALA,Delisted,6418944 / 9608521,
479 QUIRINO AVE BACLARAN PARANAQUE M.M. ,,to 6/28/1985,KALMAR CONSTRUCTION  Construction Contractor,MS ADELAIDA KALUBIRAN,Forever Banned,,
"1/F (LW), U-D,2/F (LW) & 3/F (RW) BELEN BLDG, 1787 MALATE, MANILA",maggie_lee_143@yahoo.com,4/30/2012 to 4/29/2016,KAN-YA INTERNATIONAL SERVICES CORP. Private Employment Agency,HOMER LAI LEE CHANG,Cancelled,516-3471/4005846,www.kan-yainternational.com
1/F AND 2/F 2275 F B HARRISON STREET PASAY CITY,kaojiinternational@gmail.com,2/28/2017 to 2/28/2019,KAOJI INTERNATIONAL GENERAL SERVICES CO Private Employment Agency,MELLANIE MANUEL-NAKAMURA,Valid License,8050473 / 099489203549,N/A
"2F KALAYAAN BLDG SLCEDO COR DE LA ROSA SALCEDO VILLAGE, MAKATI",None,8/31/2004 to 8/20/2007,KARA SHIPPING INC (FOR SINGA BULK CARRIERS INC) Philippine Registered Vessel,OLIMPIO AMPO JR,Expired,,None
"M-1557 LUZ HENSON BLDG, A. MABINI STREET ERMITA, MANILA",None,4/21/2008 to 4/20/2012,KARY INTERNATIONAL INC (FORMERLY GOLDEN GRAIN & GEN SERVICES & PROM CORP) Service Contractor,ICASIANO DELA ROSA LIBAO,Cancelled,3029175,None
9TH FLR SORIANO BLDG AYALA AVE MAKATI METRO MANILA ,,to,KAYAN RIVER TIMBER PRODUCTS  Service Contractor,KDM ASUNCION,Cancelled,,
"UNIT 709 7/F PRESTIGE TOWER EMERALD AVE ORTIGAS, PASIG CITY",None,9/23/2005 to 9/23/2005,KCI WORLDWIDE MANNING CORPORATION Manning Agency,ANGEL S RACOMA,Delisted,6387964/6371582 loc 24,None
"UNIT 102, TAFT OFFICE CENTER, 1986 TAFT AVENUE PASAY CITY",kcm@kcmmanpower.com,12/1/2007 to 11/30/2011,KCM INTERNATIONAL SERVICES & PLACEMENT AGENCY INC(FOR DGY INT`L SHIPTRADE) Private Employment Agency,CAROLINA YUTUC MATSUDA,Delisted,5252217,www.kcmmanpower.com
"RM 203-A, LBH BLDG, 1431 A. MABINI ST ERMITA, MANILA",pampofc@yahoo.com,10/30/2006 to 10/30/2010,KDC PLACEMENT AGENCY Private Employment Agency,ROQUE S. FADO,Cancelled,5362391/3828392,NA
"U-D&U-E 2/F BUSTAMANTE BLDG 144 DNA SOLEDAD AVE PARAÑAQUE CITY, PARAÑAQUE",NA,11/24/2010 to 5/23/2011,KDE OVERSEAS MANPOWER SERVICES CORP Private Employment Agency,JULITA L. VILLAREAL,Delisted,8239420/8239463,NA
"PAEZ BLDG 905 PADRE FAURA ST ERMITA, MANILA",,9/15/1986 to 9/15/1988,KELANTAN TECHNICAL MANAGEMENT AND PLACEMENT SERVICES Service Contractor,MR JOSE V MANIQUIZ JR,Forever Banned,,
"1ST & 2ND FLRS, KDL BLDG, 1461 PEDRO GIL ST PACO, MANILA",kenmorephilippines_inc@yahoo.com,8/20/2014 to 8/19/2018,KENMORE PLACEMENT INTERNATIONAL AGENCY INC FORMERLY KENMORE INTERNATIONAL P Private Employment Agency,ENGR LAILANIE L LUNA,Valid License,5244374/ 5266356/ 091751512623/ 09189648642/,www.kenmorephilippines_inc.com
"GF,6F,8/F&9F, ASEANA 2 BLG BRADCO AVE, ASEANA CITY PARAÑAQUE",contact.ksi@vships.com,4/30/2017 to 4/29/2021,KESTREL SHIPPING INCORPORATED Manning Agency,KATHRYN S AGUIRRE,Valid License,8589900 / 8589918 / 8589917,www.vships.com
"3/F , SOLEMIL BLDG, 1248 J. BOCOBO STREET ERMITA, MANILA",info.keysplacement@gmail.com,9/15/2014 to 9/14/2018,"KEY`S PLACEMENT, INC. Private Employment Agency",IMELDA S ENRIQUEZ,Valid License,(02) 4843082/ 8802408/ 09175338928,www.keysplacement.com
"6/F & 7/F, RUFINO TOWER, 6784 AYALA AVE COR V.A LEGASPI VILLAGE, MAKATI",ortalani.tolledo@kgjs.no,11/26/2017 to 11/25/2025,KGJS FLEET MANAGEMENT MANILA INC (FOR WESTFLEET PHILS INC) Manning Agency,GEORGE MELJOE B FRANGE,Valid License,865-2000 / 09088686374,www.kgjs.ph
"2269 NAKAR ST SAN ANDRES, MANILA",corralnorma9@yahoo.com,7/6/2015 to 7/5/2019,KHALID INTERNATIONAL RECRUITMENT AGENCY Private Employment Agency,NORMA J CORRAL,Valid License,3532559/ 0920-5457820,None
5246 VAN BURREN ST PIO DEL PILAR MAKATI ,None,2/15/2001 to 2/15/2003,KILALA INTERNATIONAL PLACEMENT AGENCY Private Employment Agency,RONALD C SANTIAGO,Delisted,4584000/ 8870121,None
"S601 & 602, A.P. BLDG, #1563 F AGONCILLO ST MALATE, MANILA",kimobo_kips@yahoo.com.ph,3/22/2012 to 3/21/2016,"KIMOBO INTERNATIONAL PERSONNEL SERVICES, INC. Private Employment Agency",KIM SIMON C SIOSON,Cancelled,4843283/0929-2821042/0905-3026005,None
"5/F ODC INT'L PLAZA 219 SALCEDO ST MAKATI CITY LEGASPI VILLAGE, MAKATI",NA,4/1/2016 to 3/31/2018,KINDEN PHILS CORPORATION Construction Contractor,ALEX B ARREZA,Valid License,8126440,NA
"U101 1F DIONES BLDG 3709 BAUTISTA ST COR CASINO ST PALANAN, MAKATI",ksimanpowerinc@gmail.com/ksiapply@gmail.com,7/21/2014 to 7/21/2018,KING SOLOMON INTERNATIONAL GLOBAL RECRUITMENT AND MANPOWER AGENCY INC Private Employment Agency,WENDELL M. SOLOMON,Valid License,8235532 / 8321805 / 09989595943 / 09175686420,None
"U-A,GF, OSM II BLG, 1865 TAFT AVE COR REMEDIOS ST MALATE, MANILA",kingsmp01@gmail.com,3/26/2016 to 3/25/2020,KING`S MANPOWER SERVICES INC Private Employment Agency,MS EMELYN D RODULFA,Valid License,5229799,www.kingsmanpower.com
"88-C, 12TH AVENUE, CUBAO QUEZON CITY",kingdom2010@yahoo.com,5/22/2015 to 5/21/2019,KINGDOM INTERNATIONAL MANPOWER SERVICES INC (FORMERLY KINGDOM INTERNATIONAL Private Employment Agency,MILAGROS U ABUHUSSEIN,Valid License,7094029/7094028,None
*15 CALLA LILY VERGONVILLE SUB PULANG LUPA II LP ,,3/7/1999 to 3/5/2001,KINGLOON ERECTORS & NAVIGATION PHILS INC  Manning Agency,MS TARCIANA SANTOS NG,Delisted,5222454,
2646-D TAFT AVENUE MALATE MANILA ,,9/4/1998 to 9/2/2000,KINGLOON ERECTORS AND NAVIGATION PHILIPPINES INC Service Contractor,MS TARCIANA SANTOS NG,Delisted,5222454 / 5224175,
M BLISS COMM`L CENTER 1198-C VITO CRUZ EXT MAKATI ,,7/12/1986 to 9/14/1989,KINGSWAY INT`L PLACEMENT SERVICES CORP (CB LOTILLA MANPOWER CORP) Construction Contractor,MR MELGRE O GRANADA,Forever Banned,,
RM. 320 3/F PHOENIX BLDG. RECOLETOS ST. INTRAMURO ,,8/2/2001 to 8/2/2003,"KINGWOOD INTERNATIONAL MARITIME SERVICES, INC. Manning Agency",ANICETO ADLAWAN,Delisted,4050115,
"99 JASMIN COR SCT REYES STS. ROXAS DISTRICT Q.C. ROXAS DISTRICT, QUEZON CITY",None,9/12/2010 to 9/11/2014,"KIRSTEN RECRUITMENT, INC. Private Employment Agency",MARIDEE T BASCO,Delisted,(02)-709-9332,None
STE 301 GIL PRECIOSA BLG #75 TIMOG AVE QUEZON CITY,kita@pworld.net.ph,12/5/2003 to 12/4/2007,"KITA TALENT MANAGEMENT, PROMOTIONS & SERVICES INC Private Employment Agency",BENJAMIN T DE LARA,Cancelled,4167779 / 4204870,None
"RM-1 SOFRABELLE BLDG POB NORTE SAN CLEMENTE TARLAC TARLAC, TARLAC",NA,6/14/2008 to 12/13/2008,KIZUNA INTERNATIONAL RECRUITMENT SERVICES Private Employment Agency,MARIA THERESA T. RIVERA,Delisted,045-9343359,NA
"UNIT-A, 11F AND UNIT B (RW),5F VERNIDA IV BLG,128  SALCEDO VILLAGE, MAKATI",crew@kjcm.com.ph,6/19/2016 to 6/18/2020,KJCM MARITIME CORPORATION Manning Agency,ARTURO M. PACULDAR,Valid License,7515731 / 7516218 / 7516219,None
"5F,FIVE E-COM CTR, HARBOR DR, MALL OF ASIA COMPLEX PASAY CITY",crewing@klaveness.com,12/4/2015 to 12/3/2019,"KLAVENESS MARITIME AGENCY, INC. Manning Agency",CHONA L VILLANOS,Valid License,478-5133,None
"GF,#99 ILANG-ILANG ST. SALVADOR ESTATE SUCAT PARAÑAQUE",None,12/27/2003 to 12/26/2007,KMG INTERNATIONAL MANPOWER CORPORATION Service Contractor,MR REYNALDO GUEVARRA,Cancelled,8251549,None
"2ND & 3RD FLOORS, THE GREGORIAN BLDG 2178 TAFT AVE MANILA",b.arcilla@ph.knutsenoas.com,5/7/2014 to 5/6/2018,KNUTSEN PHILIPPINES INC (FORMERLY NORTHERN CONFLUENCE SHIP MANAGEMENT INC) Manning Agency,BRYANT C ARCILLA,Valid License,5278556 / 09088869430,www.knutsenphilippines.com
3F THE MILE LONG BLDG AMORSOLO ST MAKATI CITY ,,to 2/8/1990,KONE MACHINERIES PHIL INC  Construction Contractor,MR ERICO S PACABA,Delisted,871295 / 852274,
"ROOM 602, GEDISCO TERRACE, 1148 ROXAS BLVD ERMITA, MANILA",KONNEXIONCANADA@YAHOO.COM,9/19/2008 to 9/19/2012,KONNEXION INTERNATIONAL MANPOWER AGENCY Private Employment Agency,MA BELEN G DELA CRUZ,Cancelled,4469434/4843181,NA
"ROOM 305, GEDISCO TERRACE, 1148 ROXAS BLVD. ERMITA, MANILA",kookiesinternational@yahoo.com,10/20/2009 to 10/19/2013,KOOKIES INTERNATIONAL RECRUITMENT AGENCY INC Private Employment Agency,ARMANDO J. ZOLETA,Cancelled,484-2419,www.kookiesinternational.com
"GF HALA BLDG, 1836 LEON GUINTO ST. MALATE, MANILA",MEDX@YAHOO.COM,11/7/2010 to 5/6/2011,KOPOS-MEDX INTERNATIONAL INCORPORATED Private Employment Agency,WILFREDO C. DELOS SANTOS,Delisted,3029206/3029197 OR 98,None
KM.16 SOUTH SUPERHIGHWAY PARANAQUE M.M. ,,to 6/30/1982,KOPPEL INC  Construction Contractor,MR CONSTANTE VENTURA,Cancelled,8274948,
"U-802&803,PEARL OF THE ORIENT TWR,1240 ROXAS BLVD ERMITA, MANILA",info@korpilshipping.com,1/19/2017 to 1/18/2021,KORPIL SHIPMANAGEMENT AND MANNING CORPORATION (FOR INTER-PACIFIC Manning Agency,ELIAS Y. DE LOS REYES III,Valid License,5261186 TO 89 / 09178824719 / 09989730624,www.korpilshipping.com
"RM 501, DOÑA FELISA SYJUCO BLDG, 1872 REMEDIOS ST  MALATE, MANILA",koseninternational@yahoo.com,12/10/2010 to 12/10/2014,KOSEN INTERNATIONAL INC Private Employment Agency,MICHELLE S. CANAMO,Cancelled,3106512,www.kosenjobs.com
"2-A, 1325 M. ADRIATICO STREET ERMITA, MANILA",kougen_manila@yahoo.com,4/15/2016 to 4/14/2020,KOUGEN INTERNATIONAL PROMOTION Private Employment Agency,MA CECILIA D TERMULO,Cancelled,310-2255/310-2266/310-2277/09399580125,None
"RMS1&2(2F) LTC TOWER 1732 DIAN ST PALANAN, MAKATI",kp.manpower@yahoo.com,6/17/2007 to 6/16/2011,KP MANPOWER SERVICES CORPORATION  Private Employment Agency,RAMIL M MERCADO,Cancelled,7293262 TO 63/ 5501008,
"U201, ERISHA COND,1142 P OCAMPO SR AVE COR DIAN MALATE, MANILA",krisaie.international@yahoo.com,3/18/2016 to 3/17/2020,"KRIS-AIE INTERNATIONAL, INC. Private Employment Agency",AGNES V. GIMENEZ,Valid License,5244788/5281991,www.krisaieinternational.com
"U-701,702,708&709, PRESTIGE TWR, EMERALD AVE ORTIGAS, PASIG CITY",kci@krisalis.com.ph,10/23/2015 to 10/22/2019,KRISALIS CONSTRUCTION INC Construction Contractor,ANGEL S RACOMA,Valid License,6371582 TO 85,www.krisalis.com.ph
RM.202-205 2/F GEDISCO CTR 1564 A.MABINI ERMITA ,,2/14/1992 to 2/14/1994,KRK INTERNATIONAL CO (FOR DP ELARDO SVC EXPORT & TRDG) Service Contractor,,Delisted,595778,
"5F & 6F, CORELA BUILDING, 3713 BAUTISTA STREET PALANAN, MAKATI",kevtrix2002@yahoo.com,3/27/2016 to 3/26/2020,KRONA INTERNATIONAL SERVICE SYSTEMS INC Private Employment Agency,MS ELSA U VILLA,Valid License,8907734 / 09277493928,www.kronacorp.com
"U-5 FELBETS BLDG KM7 DAVAO CITY DAVAO CITY, DAVAO DEL SUR",ktransc@yahoo.com,4/2/2012 to 10/1/2012,KS TRANSCARRIER MANAGEMENT CORP Manning Agency,DIONISIO S. CORBITA,Delisted,3003623,NA
"2619 G. DEL PILAR ST., SINGALONG MANILA",KTINTERNATIONALRECRUITMENTAGENCY@YAHOO.COM,2/14/2006 to 2/14/2007,KT INTERNATIONAL RECRUITMENT AGENCY Private Employment Agency,MR. KIM KUY S. CHAN,Delisted,431-4238,None
"1574-B & PENTHSE A-3 GEDISCO CTR 1564 A. MABINI ST ERMITA, MANILA",None,5/14/2007 to 5/13/2011,KU-8 INTERNATIONAL PLACEMENT AGENCY Private Employment Agency,CRISTINA D NAZAR,Cancelled,5282095,None
U-7 3F A.FRANCISCO GOLD COND. I 784 EDSA QUEZON CITY,kyrintl@yahoo.com,5/8/2015 to 5/7/2019,KYR INTERNATIONAL MANPOWER SERVICES Private Employment Agency,MA PRECILLA Y RESUENA,Valid License,4330705/4343144,None
RM.1005 SARMIENTO BLDG AYALA AVE MAKATI M.M. ,,to 10/18/1983,L & J SHIPPING AGENCY  Manning Agency,MR ANTONIO TORAYA JR,Inactive,859268,
9617 KAMAGONG STREET MAKATI CITY ,,3/8/1994 to 3/7/1996,L N UNITED PLACEMENT SERVICES COMPANY  Service Contractor,NESREEN F LACHICA,Inactive,8434937,
"3695 BAUTISTA ST., BRGY PALANAN MAKATI",lsjmanpower2016@gmail.com,4/6/2016 to 4/5/2020,L S J MANPOWER SERVICES INC Private Employment Agency,,Valid License,358-4882,www.lsjmanpower.com
"RMS 1079-B&1081-273 RAMAGI BLDG PEDRO GIL ST PACO, MANILA",lcmanpower03@gmail.com,9/25/2014 to 9/24/2018,L.C. MANPOWER EXPERTISE CORPORATION Service Contractor,ESHIRLETA A ESMORES,Valid License,3533622 / 3109148 / 09178507303,www.lcmanpower.com
APT C-2 23 DAPITAN COR DE ALEJOS STS QUEZON CITY,None,4/11/2002 to 4/10/2004,L.M.R. NURSING RECRUITMENT SERVICES INC Private Employment Agency,EDUARDO RANCHERO,Delisted,7838955,None
"RM405 GEDISCO CENTRE 1564 A MABINI ST ERMITA, MANILA",None,4/20/2001 to 4/19/2003,LA CRUISSER INTERNATIONAL SERVICES Private Employment Agency,MR ANGELITO S DAVID,Delisted,5234053 / 5251652,None
#321 ONG BUILDING BONIFACIO STREET PINAMALAYAN ORIENTAL MINDORO,lfviaggi@gmail.com,12/8/2017 to 12/8/2019,LA FORTUNA VIAGGI NEL MONDO RECRUITMENT AND MANPOWER AGENCY INC. Private Employment Agency,JOHN ROBERT R MANOY,Valid License,09778434725,None
"GF 812 & 2F 808 REINA REGENTE ST  BINONDO, MANILA",lic@pacific.net.ph,4/14/2007 to 4/13/2011,LABOR INTERNATIONAL CORPORATION Service Contractor,EDWARD C DIZON,Delisted,2321255/60,None
SUITE 27 MIDTOWN RAMADA ARCADE ADRIATICO ST ERMITA ,,1/20/1994 to 1/19/1996,LACAZ OVERSEAS MANAGEMENT CORPORATION  Private Employment Agency,MR NARCISO DELA FUENTE,Delisted,,
"784-A, QUIRINO AVENUE, BRGY. TAMBO PARAÑAQUE",lacertacrd@lacerta.ph,8/1/2016 to 7/31/2020,"LACERTA SHIPPING AGENCIES PHILS., INC. Manning Agency",FLORA M IGNACIO,Valid License,8014269 / 8014274 / 8014279,www.lacerta.net
"614-616 ESTRAUDE ST BINONDO, MANILA",lakastao1993_agency@yahoo.com,3/8/2016 to 3/7/2020,LAKAS TAO CONTRACT SERVICE LTD. CO. Service Contractor,JOSEPHINE T.TAN,Valid License,02- 2428439 to 40/ 09178584459,None
"2110 (GF) & RMS 201 & 205, 2/F, JEPCO BLDG, 2118 M MALATE, MANILA",lamhealth@rocketmail.com,9/22/2011 to 9/22/2015,LAM HEALTHCARE STAFFING CORP Private Employment Agency,MARGARITA CECE ARCILLA,Cancelled,400-5886/ 5168398,NA
24 GUAM ST BETTERLIVING SUBD PARA#AQUE M.M. ,,3/1/1995 to 3/1/1997,LAMONT STAFFBUILDERS INTERNATIONAL  Private Employment Agency,MS LOURDES MONTGOMERY,Delisted,8219923,
"3F, 1641-A DIAN ST BGY SAN ISIDRO MAKATI CITY ",lancepsinc@yahoo.com,7/1/2007 to 6/30/2011,LANCE PLACEMENT SERVICES INC Private Employment Agency,SARAH JANE S. CUSTODIO,Delisted,8884295,None
UNITS 21 & 22 CARGO VILL CMPLX N.AQUINO AVE PQUE M ,,8/6/1998 to 8/5/2000,LAND & HOUSING DEVELOPMENT CORPORATION  Construction Contractor,MS ELIZABETH ORBETA,Delisted,5510621,
GM 106 (MF) & RMS 303-304 TAFT OFFICE CTR 1986 TAF PASAY CITY,apn@landbasehr.com/annacino@landbasehr.com,1/25/2016 to 1/24/2020,LANDBASE HUMAN RESOURCES COMPANY Private Employment Agency,AGUSTIN P. NACINO,Valid License,9945481/ 9256497/ 5211714/ 09178782005,www.landbase.net
"RMS 502,503 & 407 LBH BLG, 1431 A. MABINI ST ERMITA, MANILA",NA,1/18/2008 to 1/18/2012,LANDMARK MANPOWER INTERNATIONAL AGENCY Private Employment Agency,ROSALINDA A. MANIEGO,Cancelled,6662799,NA
2/F DCG BLDG DELA ROSA & LEGASPI ST MAKATI MM ,,to 11/10/1983,LANDOIL RESOURCES CORPORATION  Construction Contractor,MR NICASIO DE VENECIA,Cancelled,858702 / 885541,
"RM 504, L&S BLDG, 1414 ROXAS BLVD ERMITA, MANILA",hr@laqinternational.com,6/23/2011 to 6/22/2015,"LAQ INTERNATIONAL PLACEMENT, INC. Service Contractor",MA LUISA B PETALLO,Cancelled,FOR INSTALLATION,www.laqinternational.com
878 G/F DONA MATILDE BLDG L.GUINTO ST ERMITA ,,to 11/25/1984,LAS PALMAS INTERNATIONAL MANPOWER CORPORATION Private Employment Agency,CAPT DONALD V PALMA,Forever Banned,5217060,
MATILDE BLDG 878 APACIBLE COR L.GUINTO ST ERMITA ,,7/11/1986 to 7/11/1988,LAS PALMAS INTERNATIONAL SHIPPING CORPORATION Manning Agency,CAPT DONALD V PALMAS,Forever Banned,508450 / 5217060,
S2B 2F ALBAR BLDG 425 A.FLORES ST ERMITA MANILA ,,5/19/1994 to 5/19/1996,LASCO INTERNATIONAL MANPOWER AGENCY INC  Private Employment Agency,MS FREDELINA M LASCO,Delisted,593222,
